CUMMINSIND.NS,Cummins India Office Campus,"Tower A, 5th Floor Survey No. 21 Balewadi",Pune,411045,India,91 20 6706 7000,91 20 6706 7015,https://www.cummins.com/en/in/company/cummins-india?locset=IN,Specialty Industrial Machinery,specialty-industrial-machinery,Specialty Industrial Machinery,Industrials,industrials,Industrials,"Cummins India Limited designs, manufactures, distributes, and services engines, generator sets, and related technologies in India. The company operates through two segments: Engines; and Lubes. The company provides accelera, G-drive, pumps, and browse engines for agriculture, compressor engines, construction, marine, mining, oil and gas, truck, and rail industries; and generators and power systems, integrated power systems, alternators, transfer switches, generator set controls, system level controls and switchgears, and browse generators for data centers, healthcare, hospitality, infrastructure, manufacturing, marine, and reality industries. It offers holset turbochargers, power turbines, two-stage systems, turbo componentry, and turbocharger brochures; aftertreatment; components care centers; and electronics and fuel systems. In addition, it offers digital products; and other parts and sales and services. It exports its products to the United States, Europe, Mexico, Africa, the Middle East, and China. The company was incorporated in 1962 and is headquartered in Pune, India. Cummins India Limited is a subsidiary of Cummins Inc.",3161.0,"[{'maxAge': 1, 'name': 'Mr. Ashwath  Ram', 'age': 52, 'title': 'MD & Additional Executive Director', 'yearBorn': 1971, 'fiscalYear': 2023, 'totalPay': 47700000, 'exercisedValue': 0, 'unexercisedValue': 0}, {'maxAge': 1, 'name': 'Mr. Ajay Shriram Patil', 'title': 'Chief Financial Officer', 'fiscalYear': 2023, 'exercisedValue': 0, 'unexercisedValue': 0}, {'maxAge': 1, 'name': 'Ms. Vinaya Abhijit Joshi', 'title': 'Company Secretary & Compliance Officer', 'fiscalYear': 2023, 'exercisedValue': 0, 'unexercisedValue': 0}, {'maxAge': 1, 'name': 'Ms. Anjali  Pandey', 'title': 'Chief Operating Officer', 'fiscalYear': 2023, 'exercisedValue': 0, 'unexercisedValue': 0}, {'maxAge': 1, 'name': 'Annapurna  Vishwanathan', 'title': 'Chief Information Officer', 'fiscalYear': 2023, 'exercisedValue': 0, 'unexercisedValue': 0}, {'maxAge': 1, 'name': 'Ashish  Aggarwal', 'title': 'Chief Administrative Officer', 'fiscalYear': 2023, 'exercisedValue': 0, 'unexercisedValue': 0}, {'maxAge': 1, 'name': 'Sanjit  Batra', 'title': 'Vice President of Legal & Secretarial', 'fiscalYear': 2023, 'exercisedValue': 0, 'unexercisedValue': 0}, {'maxAge': 1, 'name': 'Mr. Amit S. Kumar', 'age': 60, 'title': 'Chief of Staff, Strategy and Head of Corporate Responsibility', 'yearBorn': 1963, 'fiscalYear': 2023, 'exercisedValue': 0, 'unexercisedValue': 0}, {'maxAge': 1, 'name': 'Pradheepram  Ottikkutti', 'title': 'Head of Engineering of Cummins Group in India', 'fiscalYear': 2023, 'exercisedValue': 0, 'unexercisedValue': 0}, {'maxAge': 1, 'name': 'Shubhankar  Chatterji', 'title': 'Chief Supply Chain Officer', 'fiscalYear': 2023, 'exercisedValue': 0, 'unexercisedValue': 0}]",1703980800.0,86400,2,2235.6,2231.1,2190.05,2306.75,2235.6,2231.1,2190.05,2306.75,26.0,0.0116,1690329600.0,0.47939998,2.14,0.787,44.036285,962480,962480,530687,547180,547180,640050659328,1405.2,2306.75,7.750026,1989.586,1815.25,INR,612164370432,0.17503001,135245732,277200000,0.51205003,0.31496,279028992,219.296,10.460063,1680220800,1711843200,1696032000,0.231,14455199744,52.09,7:5,1316476800.0,7.412,37.306,0.56719244,0.19561028,13.0,1690329600.0,NSI,EQUITY,CUMMINSIND.NS,CUMMINSIND.NS,CUMMINS INDIA,Cummins India Limited,1025495100,Asia/Kolkata,IST,44877839-c12f-320d-914d-2b776228dbc6,finmb_878459,19800000,2293.85,none,26569199616,95.833,16409199616.0,2774799872.0,2.184,2.829,82586902528,4.564,297.925,0.1204,0.25362,8936675328.0,11862700032.0,0.231,-0.018,0.33717,0.19869,0.20698,INR,,,,,,,,,,,,,,,,,,,,
DABUR.NS,Kaushambi,Sahibabad,Ghaziabad,201010,India,91 12 0396 2100,91 12 0437 4929,https://www.dabur.com,Household & Personal Products,household-personal-products,Household & Personal Products,Consumer Defensive,consumer-defensive,Consumer Defensive,"Dabur India Limited operates as a fast-moving consumer goods company worldwide. It operates through Consumer Care Business, Foods Business, Retail Business, and Other segments. The company manufactures and sells health supplements under the Dabur Chyawanprash, Dabur Vita, Dabur Honey, Dabur Immunity Kit, Dabur Vedic Suraksha Tea, and Dabur Glucose brands; digestive products under the Dabur Hajmola, Pudin Hara, Hingoli, Dabur Nature Care, and Sat Isabgol brands; and shampoos under the Dabur Almond and Vatika brands. It also offers hair oils under the Dabur Amla, Vatika, Dabur Almond, and Anmol brands; skin care products under the Dabur Gulabari, Oxylife, and Dabur Fem brands; and oral care products under the Dabur Red Paste, Dabur Meswak, Dabur Babool, Dabur Lal Dant Manjan, Dabur Red Pulling Oil, and Dabur Dant Rakshak Ayurvedic Paste brands. In addition, the company provides fruit juices under the Real and Real Activ brands; various cooking pastes under the Hommade brand; and milk-based beverages under the Real Milk Power brand. Further, it offers energizers and rejuvenators under the Shilajit, Shilajit Gold, Shilajit Double Gold, and Dabur Musli Gold names; cough and cold products under the Dabur Honitus and Dabur Tulsi Drops brands name; health juices; women's health products, such as Dabur Dashmularishta and Dabur Ashokarishta; ayurvedic baby massage oil for babies under the Dabur Lal Tail name; and ayurvedic ethical products. Additionally, the company provides mosquito repellents under the Odomos brand name; air fresheners under the Odonil name; toilet cleaners under the Sanifresh Shine brand name; dish wash products under the Odopic name; and natural gum products under brand name DABISCO. It also operates specialized beauty retail stores that offer a range of cosmetics, fragrances, skin care, and personal care products, as well as beauty and fashion accessories under the NewU brand name. Dabur India Limited was founded in 1884 and is based in Ghaziabad, India.",5319.0,"[{'maxAge': 1, 'name': 'Mr. Mohit  Malhotra M.B.A.', 'age': 54, 'title': 'CEO & Whole Time Director', 'yearBorn': 1969, 'fiscalYear': 2023, 'totalPay': 133542420, 'exercisedValue': 0, 'unexercisedValue': 0}, {'maxAge': 1, 'name': 'Mr. Pritam Das Narang AICWA, B.Com, FCA, FCS, MIIA (USA)', 'age': 69, 'title': 'Group Director of Corporate Affairs & Whole Time Director', 'yearBorn': 1954, 'fiscalYear': 2023, 'totalPay': 150345264, 'exercisedValue': 0, 'unexercisedValue': 0}, {'maxAge': 1, 'name': 'Mr. Ankush  Jain', 'age': 48, 'title': 'CFO & Joint Chief Risk Officer', 'yearBorn': 1975, 'fiscalYear': 2023, 'exercisedValue': 0, 'unexercisedValue': 0}, {'maxAge': 1, 'name': 'Mr. Shahrukh Adi Khan B.E.', 'age': 60, 'title': 'Executive Director of Operations', 'yearBorn': 1963, 'fiscalYear': 2023, 'exercisedValue': 0, 'unexercisedValue': 0}, {'maxAge': 1, 'name': 'Mr. Narendra  Agrawal', 'title': 'Chief Information Officer', 'fiscalYear': 2023, 'exercisedValue': 0, 'unexercisedValue': 0}, {'maxAge': 1, 'name': 'Mr. Ashok Kumar Jain L.L.B., B.Com., C.A., C.S.', 'age': 60, 'title': 'Chief Compliance Officer, Joint Chief Risk Officer, Executive VP of Finance & Company Secretary', 'yearBorn': 1963, 'fiscalYear': 2023, 'exercisedValue': 0, 'unexercisedValue': 0}, {'maxAge': 1, 'name': 'Mr. Adarsh  Sharma', 'age': 60, 'title': 'Executive Vice President of Sales', 'yearBorn': 1963, 'fiscalYear': 2023, 'exercisedValue': 0, 'unexercisedValue': 0}, {'maxAge': 1, 'name': 'Mr. Devender  Gupta', 'title': 'Vice President of Human Resources', 'fiscalYear': 2023, 'exercisedValue': 0, 'unexercisedValue': 0}, {'maxAge': 1, 'name': 'Mr. A.  Sudhakar', 'age': 72, 'title': 'Head of Corporate Social Responsibility', 'yearBorn': 1951, 'fiscalYear': 2023, 'exercisedValue': 0, 'unexercisedValue': 0}, {'maxAge': 1, 'name': 'Mr. Arun  Gupta B.Com.(H), C.A., FCA, FICWA, I.C.W.A', 'age': 61, 'title': 'Executive Vice President of Corporate Affairs', 'yearBorn': 1962, 'fiscalYear': 2023, 'exercisedValue': 0, 'unexercisedValue': 0}]",1703980800.0,86400,2,535.95,535.95,534.0,545.6,535.95,535.95,534.0,545.6,5.5,0.010299999,1699574400.0,0.5263,0.77,0.241,54.726166,3475866,3475866,1959245,1572112,1572112,956192718848,503.65,597.1,7.9317336,543.801,549.94775,INR,952765710336,0.14564,576873699,1772039936,0.66399,0.20306998,1788540032,53.604,10.066413,1680220800,1711843200,1696032000,0.051,17557000192,9.86,2:1,1283904000.0,7.903,42.205,-0.04626745,0.19561028,2.75,1699574400.0,NSI,EQUITY,DABUR.NS,DABUR.NS,DABUR INDIA LTD,Dabur India Limited,1025495100,Asia/Kolkata,IST,c7b1d514-1533-3413-9472-db8eab4c76bb,finmb_881258,19800000,539.6,buy,21708500992,12.265,22574700544.0,14890500096.0,0.84,1.431,120552800256,14.98,68.038,0.08781999,0.18447,14684550144.0,21176799232.0,0.051,0.073,0.46049,0.18726,0.17559,INR,,3.0,8.0,9.0,1.0,8.0,1706400000.0,42.58879,12.67,3.08,690.0,510.0,608.23,606.5,2.2,44.0,5.45,0.010168859,,
DALBHARAT.NS,Hansalaya Building,"11th & 12th Floors 15, Barakhamba Road",New Delhi,110001,India,91 11 2346 5100,91 11 2331 3303,https://www.dalmiabharat.com,Building Materials,building-materials,Building Materials,Basic Materials,basic-materials,Basic Materials,"Dalmia Bharat Limited, together with its subsidiaries, manufactures and sells clinker and cement products to individual consumers and institutional customers. It provides Portland slag cement, Portland pozzolana cement, Portland composite cement, ordinary Portland cement, and specialty cement under the Dalmia Cement, Konark Cement, and Dalmia DSP brands. The company also offers refractory products; sugar products; power; and management consultancy services. The company was formerly known as Odisha Cement Limited and changed its name to Dalmia Bharat Limited in April 2019. Dalmia Bharat Limited was founded in 1939 and is headquartered in New Delhi, India.",5642.0,"[{'maxAge': 1, 'name': 'Mr. Puneet Yadu Dalmia B.Tech., M.B.A.', 'age': 51, 'title': 'MD, CEO & Executive Director', 'yearBorn': 1972, 'fiscalYear': 2023, 'totalPay': 233700000, 'exercisedValue': 0, 'unexercisedValue': 0}, {'maxAge': 1, 'name': 'Mr. Rajiv  Bansal', 'age': 50, 'title': 'President & Chief Transformation Officer', 'yearBorn': 1973, 'fiscalYear': 2023, 'exercisedValue': 0, 'unexercisedValue': 0}, {'maxAge': 1, 'name': 'Mr. Dharmender  Tuteja', 'age': 56, 'title': 'Chief Financial Officer', 'yearBorn': 1967, 'fiscalYear': 2023, 'exercisedValue': 0, 'unexercisedValue': 0}, {'maxAge': 1, 'name': 'Ms. Aditi  Mittal', 'age': 37, 'title': 'Head of Investor Relations', 'yearBorn': 1986, 'fiscalYear': 2023, 'exercisedValue': 0, 'unexercisedValue': 0}, {'maxAge': 1, 'name': 'Mr. Rajeev  Kumar', 'age': 50, 'title': 'Company Secretary & Compliance Officer', 'yearBorn': 1973, 'fiscalYear': 2023, 'exercisedValue': 0, 'unexercisedValue': 0}, {'maxAge': 1, 'name': 'Mr. Rajiv Kumar Choubey', 'age': 51, 'title': 'Group General Counsel', 'yearBorn': 1972, 'fiscalYear': 2023, 'exercisedValue': 0, 'unexercisedValue': 0}, {'maxAge': 1, 'name': 'Ms. Madhuri  Mehta', 'age': 44, 'title': 'Chief Human Resource Officer', 'yearBorn': 1979, 'fiscalYear': 2023, 'exercisedValue': 0, 'unexercisedValue': 0}, {'maxAge': 1, 'name': 'Mr. Gautam  Dalmia M.S', 'age': 55, 'title': 'MD & Executive Director', 'yearBorn': 1968, 'fiscalYear': 2023, 'totalPay': 206300000, 'exercisedValue': 0, 'unexercisedValue': 0}, {'maxAge': 1, 'name': 'Dr. Arvind Madhukar Bodhankar', 'age': 54, 'title': 'Head ESG, Chief Risk Officer & Executive Director', 'yearBorn': 1969, 'fiscalYear': 2023, 'exercisedValue': 0, 'unexercisedValue': 0}, {'maxAge': 1, 'name': 'Mr. Pankaj  Rastogi', 'age': 59, 'title': 'Chief Operating Officer', 'yearBorn': 1964, 'fiscalYear': 2023, 'exercisedValue': 0, 'unexercisedValue': 0}]",1703980800.0,86400,2,2260.05,2260.05,2256.65,2294.95,2260.05,2260.05,2256.65,2294.95,9.0,0.004,1697760000.0,0.1533,,0.616,38.798504,297941,297941,393629,456356,456356,427656282112,1706.65,2430.7,2.9937437,2273.736,2163.333,INR,437041070080,0.077,69942137,187548000,0.52966,0.08963,187584992,853.782,2.6702368,1680220800,1711843200,1703980800,0.289,11000000512,58.76,,,3.059,16.3,0.27801967,0.19561028,4.0,1697760000.0,NSI,EQUITY,DALBHARAT.NS,DALBHARAT.NS,DALMIA BHARAT LTD,Dalmia Bharat Limited,1545363900,Asia/Kolkata,IST,4c10511d-18f4-32ac-8df0-bc0ca4df98d4,finmb_6437468,19800000,2279.8,buy,45539999744,242.818,26812499968.0,53989998592.0,,,142849998848,33.507,761.725,,,,,0.29,0.073,0.57907003,0.1877,0.1125,INR,,,,,,,,30.675459,74.32,,2650.0,1035.0,2218.17,2242.5,1.8,24.0,9.0,0.003982213,,
DEEPAKNTR.NS,Aaditya-I,Chhani Road,Vadodara,390024,India,91 26 5276 5200,91 26 5276 5344,https://www.godeepak.com,Chemicals,chemicals,Chemicals,Basic Materials,basic-materials,Basic Materials,"Deepak Nitrite Limited manufactures and sells chemical intermediates in India and internationally. It operates through Advanced Intermediates and Phenolics segments. The company offers sodium nitrite, sodium nitrate, nitro toluidines, fuel additives, nitrosyl sulphuric acid, xylidines, oximes, cumidines, speciality agrochemicals, optical brightening agent, and diamino stilbene disulfonic acid for colourants, rubber chemicals, explosives, dyes, pigments, food colours, pharmaceuticals, diesel blending, agrochemicals, glass, personal care, paper, detergents, and textiles industries. In addition, it provides cumene, phenol, acetone, isopropyl alcohol, and AMS for various applications including laminates, ply, adhesive, paints, auto, pharmaceuticals, plastics, etc. Deepak Nitrite Limited was incorporated in 1970 and is headquartered in Vadodara, India.",1694.0,"[{'maxAge': 1, 'name': 'Mr. Deepak Chimanlal Mehta B.Sc.', 'age': 67, 'title': 'Chairman & MD', 'yearBorn': 1956, 'fiscalYear': 2023, 'totalPay': 69900000, 'exercisedValue': 0, 'unexercisedValue': 0}, {'maxAge': 1, 'name': 'Mr. Maulik Deepak Mehta', 'age': 40, 'title': 'CEO & Executive Director', 'yearBorn': 1983, 'fiscalYear': 2023, 'totalPay': 37900000, 'exercisedValue': 0, 'unexercisedValue': 0}, {'maxAge': 1, 'name': 'Mr. Somsekhar Asimkumar Nanda', 'age': 56, 'title': 'CFO & Chief Risk Officer', 'yearBorn': 1967, 'fiscalYear': 2023, 'totalPay': 11100000, 'exercisedValue': 0, 'unexercisedValue': 0}, {'maxAge': 1, 'name': 'Mr. Sanjay B. Upadhyay', 'age': 62, 'title': 'Director of Finance, Group CFO & Whole-Time Director', 'yearBorn': 1961, 'fiscalYear': 2023, 'totalPay': 49300000, 'exercisedValue': 0, 'unexercisedValue': 0}, {'maxAge': 1, 'name': 'Jagdeep Amritlal Vyas', 'age': 63, 'title': 'Senior General Manager of Accounts & Taxation', 'yearBorn': 1960, 'fiscalYear': 2023, 'exercisedValue': 0, 'unexercisedValue': 0}, {'maxAge': 1, 'name': 'Mr. Aminmahamad  Ismaili', 'age': 55, 'title': 'Senior General Manage of Technology Development', 'yearBorn': 1968, 'fiscalYear': 2023, 'exercisedValue': 0, 'unexercisedValue': 0}, {'maxAge': 1, 'name': 'Mr. Arvind  Bajpai', 'age': 51, 'title': 'Company Secretary & Compliance Officer', 'yearBorn': 1972, 'fiscalYear': 2023, 'exercisedValue': 0, 'unexercisedValue': 0}, {'maxAge': 1, 'name': 'Dr. Prashant  Rao', 'age': 50, 'title': 'Vice President of Human Resource', 'yearBorn': 1973, 'fiscalYear': 2023, 'exercisedValue': 0, 'unexercisedValue': 0}, {'maxAge': 1, 'name': 'Mr. Girish R. Satarkar', 'age': 59, 'title': 'President of BI & Executive Director', 'yearBorn': 1964, 'fiscalYear': 2023, 'exercisedValue': 0, 'unexercisedValue': 0}, {'maxAge': 1, 'name': 'Mr. Gandhasiri Kamalakar Rao', 'age': 63, 'title': 'Head of Fine & Speciality Chemicals', 'yearBorn': 1960, 'fiscalYear': 2023, 'exercisedValue': 0, 'unexercisedValue': 0}]",1703980800.0,86400,2,2218.5,2208.05,2208.05,2320.0,2218.5,2208.05,2208.05,2320.0,7.5,0.0034,1690416000.0,0.1282,0.73,0.394,39.369984,392910,392910,413404,239294,239294,314614710272,1730.0,2521.15,4.1955285,2317.571,2137.0408,INR,309704196096,0.106400006,68731798,136392992,0.49594003,0.21777001,136439008,318.424,7.241602,1680220800,1711843200,1696032000,0.175,7978899968,58.57,5:1,1403222400.0,4.13,26.006,0.20155978,0.19561028,7.5,1690416000.0,NSI,EQUITY,DEEPAKNTR.NS,DEEPAKNTR.NS,DEEPAK NITRITE,Deepak Nitrite Limited,1285731900,Asia/Kolkata,IST,9e71a47e-089e-398f-85ea-5340a903be64,finmb_8069525,19800000,2305.9,none,5389000192,39.521,11909000192.0,669000000.0,2.544,3.743,74988101632,1.541,549.837,0.13035,0.19964,2723650048.0,8825900032.0,0.176,-0.094,0.257,0.15880999,0.14782,INR,,,,,,,,,,,,,,,,,,,,
DELTACORP.NS,Delta House,"Hornby Vellard Estate Dr. Annie Besant Road Next to Copper Chimney, Worli",Mumbai,400018,India,91 22 6987 4700,,https://www.deltacorp.in,Resorts & Casinos,resorts-casinos,Resorts & Casinos,Consumer Cyclical,consumer-cyclical,Consumer Cyclical,"Delta Corp Limited, together with its subsidiaries, operates in the gaming and entertainment, and hospitality businesses in India and internationally. It operates through three segments: Casino Gaming, Online Skill Gaming, and Hospitality. The Casino Gaming segment operates offshore casinos, including Deltin Royale, Deltin JAQK, and King Casino in Goa; land based casinos, such as Deltin Suites Casino and Deltin Zuri in Goa and Deltin Denzong in Sikkim; and Deltin Casino in Kathmandu, Nepal. The Online Skill Gaming segment operates Adda52.com, an online poker games site; Adda52Rummy.com, an online rummy game site; and Adda.games, which offers online multi-games. The Hospitality segment operates The Deltin, a five-star hotel, which include 176 rooms, 3 gourmet restaurants, and 2 bars located in Daman; and Deltin Suites, an all-suite hotel, which comprise 106 rooms, a restaurant, a bar, and a gym and spa facilities located in Goa. Delta Corp Limited was incorporated in 1990 and is based in Mumbai, India.",3286.0,"[{'maxAge': 1, 'name': 'Mr. Ashish Kiran Kapadia', 'age': 54, 'title': 'MD & Executive Director', 'yearBorn': 1969, 'fiscalYear': 2023, 'totalPay': 21900000, 'exercisedValue': 0, 'unexercisedValue': 0}, {'maxAge': 1, 'name': 'Mr. Dilip  Vaidya', 'title': 'VP of Secretarial, Company Secretary & Compliance Officer', 'fiscalYear': 2023, 'exercisedValue': 0, 'unexercisedValue': 0}, {'maxAge': 1, 'name': 'Mr. Anil  Malani', 'age': 56, 'title': 'President & CFO', 'yearBorn': 1967, 'fiscalYear': 2023, 'exercisedValue': 0, 'unexercisedValue': 0}, {'maxAge': 1, 'name': 'Mr. Manoj  Jain', 'title': 'Chief Operating Officer', 'fiscalYear': 2023, 'exercisedValue': 0, 'unexercisedValue': 0}, {'maxAge': 1, 'name': 'Ms. Anjali Jaydev Mody', 'age': 37, 'title': 'President of Projects for Design & Execution', 'yearBorn': 1986, 'fiscalYear': 2023, 'exercisedValue': 0, 'unexercisedValue': 0}]",1703980800.0,86400,2,138.9,139.65,139.1,141.65,138.9,139.65,139.1,141.65,1.25,0.009,1688688000.0,0.15010001,0.63,0.792,16.866747,2017387,2017387,6451342,2805181,2805181,37635313664,122.6,257.5,3.7549326,143.429,177.5895,INR,30948698112,0.22249001,173442418,267771008,0.33892,0.15833001,267867008,87.584,1.6041743,1680220800,1711843200,1703980800,-0.593,2230000128,8.33,10:1,1200355200.0,3.088,10.783,-0.29042143,0.19561028,1.25,1688688000.0,NSI,EQUITY,DELTACORP.NS,DELTACORP.NS,DELTA CORP LTD,Delta Corp Limited,1193975100,Asia/Kolkata,IST,e922f328-97a5-3be4-a80c-509fa945de00,finmb_20333152,19800000,140.5,none,7337800192,27.453,2870099968.0,708800000.0,,,10022899712,3.015,37.451,,,,,-0.592,-0.152,0.61538,0.28635,0.17161,INR,,,,,,,,,,,,,,,,,,,,
DIVISLAB.NS,Divi Towers,1-72/23(P)/DIVIS/303 Cyber Hills Gachibowli,Hyderabad,500032,India,91 40 6696 6300,91 40 6696 6460,https://www.divislabs.com,Drug Manufacturers - Specialty & Generic,drug-manufacturers-specialty-generic,Drug Manufacturers - Specialty & Generic,Healthcare,healthcare,Healthcare,"Divi's Laboratories Limited engages in the manufacture and sale of generic active pharmaceutical ingredients (APIs) and intermediates, and nutraceutical ingredients in India, North America, Asia, Europe, and internationally. It also undertakes custom synthesis contract manufacturing services of APIs and intermediates; and supplies a range of carotenoids, such as beta carotene, astaxanthin, lycopene, and canthaxanthin, as well as other finished forms, including lutein, and vitamins to food, dietary supplement, and feed manufacturers industries. It also exports its products. The company was formerly known as Divi's Research Center and changed its name to Divi's Laboratories Limited in 1994. The company was incorporated in 1990 and is headquartered in Hyderabad, India.",8433.0,"[{'maxAge': 1, 'name': 'Dr. Kiran Satchandra Divi B. Pharm., M.Pharm', 'age': 47, 'title': 'CEO & Whole-Time Director', 'yearBorn': 1976, 'fiscalYear': 2023, 'totalPay': 247900000, 'exercisedValue': 0, 'unexercisedValue': 0}, {'maxAge': 1, 'name': 'Mr. L. Kishore Babu B.Com, FCMA, FICWA', 'age': 71, 'title': 'Chief Financial Officer', 'yearBorn': 1952, 'fiscalYear': 2023, 'exercisedValue': 0, 'unexercisedValue': 0}, {'maxAge': 1, 'name': 'Mr. M. Satish Choudhury', 'title': 'Company Secretary & Compliance Officer', 'fiscalYear': 2023, 'exercisedValue': 0, 'unexercisedValue': 0}, {'maxAge': 1, 'name': 'Mr. Venkata Ramana Nimmagadda B.Sc.(Chem)', 'age': 65, 'title': 'Executive Director', 'yearBorn': 1958, 'fiscalYear': 2023, 'totalPay': 363100000, 'exercisedValue': 0, 'unexercisedValue': 0}, {'maxAge': 1, 'name': 'Dr. Murali Krishna Prasad Divi M. Pharm, Ph.D.', 'age': 72, 'title': 'MD & Executive Director', 'yearBorn': 1951, 'fiscalYear': 2023, 'totalPay': 704900000, 'exercisedValue': 0, 'unexercisedValue': 0}, {'maxAge': 1, 'name': 'Ms. Nilima Prasad Divi', 'age': 41, 'title': 'Whole-time Director, Chief Control Officer & Director of Commercial', 'yearBorn': 1982, 'fiscalYear': 2023, 'totalPay': 246400000, 'exercisedValue': 0, 'unexercisedValue': 0}, {'maxAge': 1, 'name': 'Mr. L. Ramesh Babu LLB, M.Com, MBA', 'age': 66, 'title': 'VP of Procurement & Chief Information Officer', 'yearBorn': 1957, 'fiscalYear': 2023, 'exercisedValue': 0, 'unexercisedValue': 0}, {'maxAge': 1, 'name': 'Mr. Satya Prakash Divi B.Tech (Mech), MBA, MS (CIS)', 'age': 46, 'title': 'Vice President of Sales & Marketing', 'yearBorn': 1977, 'fiscalYear': 2023, 'exercisedValue': 0, 'unexercisedValue': 0}, {'maxAge': 1, 'name': 'Mr. Y. T. S. Prasad B.E.', 'age': 54, 'title': 'Global Quality Head', 'yearBorn': 1969, 'fiscalYear': 2023, 'exercisedValue': 0, 'unexercisedValue': 0}, {'maxAge': 1, 'name': 'Mr. M. Ramesh Babu B.Sc.', 'age': 57, 'title': 'Chief Technologist', 'yearBorn': 1966, 'fiscalYear': 2023, 'exercisedValue': 0, 'unexercisedValue': 0}]",1703980800.0,86400,2,3551.7,3585.0,3560.05,3680.9,3551.7,3585.0,3560.05,3680.9,30.0,0.0084,1691712000.0,0.598,1.14,0.374,73.29473,840680,840680,494248,558484,558484,974430535680,2730.0,4074.4,13.265482,3771.456,3622.3525,INR,938286907392,0.18125,134143249,265468992,0.52301997,0.28649,266086000,477.573,7.6859455,1680220800,1711843200,1696032000,-0.295,13313800192,50.08,2:1,1442966400.0,12.773,49.931,0.058045506,0.19561028,30.0,1691712000.0,NSI,EQUITY,DIVISLAB.NS,DIVISLAB.NS,DIVI'S LABORATORIE,Divi's Laboratories Limited,1047440700,Asia/Kolkata,IST,4819e1b5-d4f6-3c4d-915f-879c60b579a1,finmb_9249099,19800000,3670.6,buy,36110000128,136.035,18791499776.0,50000000.0,5.409,8.785,73456099328,0.039,276.746,0.06843,0.10732,5100924928.0,15127300096.0,-0.285,0.029,0.55311,0.25582,0.20115,INR,,10.0,1.0,2.0,1.0,2.0,1706400000.0,65.19716,56.3,,6070.0,3300.0,4951.17,5207.5,2.3,18.0,,,,
