PAGEIND.NS,"Tower-1, Cessna Business Park","7th Floor Umiya Business Bay Varthur Hobli, Outer Ring Road",Bengaluru,560103,India,91 80 4945 4545,91 80 4946 5700,https://www.jockey.in,Apparel Manufacturing,apparel-manufacturing,Apparel Manufacturing,Consumer Cyclical,consumer-cyclical,Consumer Cyclical,"Page Industries Limited manufactures, markets, and distributes textile garments and clothing accessories for men, women, and junior girls and boys in India and internationally. The company offers vests, briefs, boxer briefs, trunks, inner boxers, tank tops, t-shirts, polos, henleys, sweatshirts, jackets, hoodies, boxer shorts, shorts, bermudas, joggers, track pants, pyjamas, pants, bras, panties, crop tops, camisoles, kurta and kurti slips, sleep dresses, capris, leggings, hipsters, mid-waists, boy legs, bloomers, shorties, caps, handkerchief, and masks; face, hand, and bath towels; calf, ankle, knee, low show, and no show socks; and thermals under Jockey brand. It also provides swimwear, water shorts, apparel, and equipment and footwear under the Speedo brand. Page Industries Limited was incorporated in 1994 and is headquartered in Bengaluru, India.",23853.0,"[{'maxAge': 1, 'name': 'Mr. Sunder  Genomal M. Tech', 'age': 69, 'title': 'Founder & Non-Executive Chairman', 'yearBorn': 1954, 'fiscalYear': 2023, 'totalPay': 7556000, 'exercisedValue': 0, 'unexercisedValue': 0}, {'maxAge': 1, 'name': 'Mr. V. S. Ganesh Sr.', 'age': 55, 'title': 'CEO, MD & Executive Director', 'yearBorn': 1968, 'fiscalYear': 2023, 'totalPay': 44470000, 'exercisedValue': 0, 'unexercisedValue': 0}, {'maxAge': 1, 'name': 'Mr. C.  Murugesh', 'title': 'Company Secretary & Compliance Officer', 'fiscalYear': 2023, 'exercisedValue': 0, 'unexercisedValue': 0}, {'maxAge': 1, 'name': 'Mr. Shamir  Genomal', 'age': 39, 'title': 'Deputy MD & Director', 'yearBorn': 1984, 'fiscalYear': 2023, 'totalPay': 22860000, 'exercisedValue': 0, 'unexercisedValue': 0}, {'maxAge': 1, 'name': 'Mr. Deepanjan  Bandyopadhyay', 'title': 'CFO and VP of Finance & Accounts', 'fiscalYear': 2023, 'exercisedValue': 0, 'unexercisedValue': 0}, {'maxAge': 1, 'name': 'Mr. Gagan  Sehgal', 'age': 45, 'title': 'Chief Operating Officer', 'yearBorn': 1978, 'fiscalYear': 2023, 'exercisedValue': 0, 'unexercisedValue': 0}, {'maxAge': 1, 'name': 'Mr. Ashok  Cherian', 'age': 55, 'title': 'Chief Information Officer - IT', 'yearBorn': 1968, 'fiscalYear': 2023, 'exercisedValue': 0, 'unexercisedValue': 0}, {'maxAge': 1, 'name': 'Mr. Minor  Ganesan', 'age': 52, 'title': 'Chief Human Resource Officer', 'yearBorn': 1971, 'fiscalYear': 2023, 'exercisedValue': 0, 'unexercisedValue': 0}, {'maxAge': 1, 'name': 'Mr. M. C. Cariappa', 'age': 53, 'title': 'Chief Strategy Officer', 'yearBorn': 1970, 'fiscalYear': 2023, 'exercisedValue': 0, 'unexercisedValue': 0}, {'maxAge': 1, 'name': 'Ms. Shelagh Margaret Commons', 'age': 52, 'title': 'Head of Product - Mens & Boys Wear', 'yearBorn': 1971, 'fiscalYear': 2023, 'exercisedValue': 0, 'unexercisedValue': 0}]",1703980800.0,86400,2,36973.2,36950.2,36876.55,37400.3,36973.2,36950.2,36876.55,37400.3,300.0,0.0081,1700179200.0,0.5788,0.79,0.45,81.38831,12384,12384,27095,22767,22767,416343293952,34952.65,43570.0,9.060191,37590.938,38684.61,INR,416861650944,0.111140005,5351417,11153900,0.46506,0.35126,11157800,1371.639,27.204023,1680220800,1711843200,1696032000,-0.073,5107234816,458.47,,,9.071,54.377,-0.08588749,0.19561028,75.0,1700179200.0,NSI,EQUITY,PAGEIND.NS,PAGEIND.NS,PAGE INDUSTRIES LT,Page Industries Limited,1174016700,Asia/Kolkata,IST,c7dd12b7-dc9c-314e-b657-96c06405e5cd,finmb_30644230,19800000,37314.1,hold,1206274048,108.146,7666132992.0,1861611008.0,0.285,1.914,45953036288,12.168,4119.88,0.17575,0.35901,3046103808.0,5569849856.0,-0.073,-0.103,0.52709997,0.16683,0.18566,INR,,3.0,7.0,3.0,1.0,4.0,1706400000.0,53.476986,697.76,1.16,46304.0,32000.0,39475.9,38850.0,2.9,22.0,270.0,0.007302587,,
PERSISTENT.NS,Bhageerath,"402, Senapati Bapat Road",Pune,411016,India,91 20 6703 0000,91 20 6703 0008,https://www.persistent.com,Information Technology Services,information-technology-services,Information Technology Services,Technology,technology,Technology,"Persistent Systems Limited engages in the provision of software products, services, and technology solutions in India, North America, and internationally. It provides experience design, digital innovation labs, and technology advisory and consulting services; product and platform strategy and engineering, as well as product modernization, sustenance, and support services; and CX strategy, Salesforce cloud implementation, CX platform integration, customer analytics and insights, Salesforce industry solutions and accelerators. The company also offers business process management, robotic process automation, and conversational artificial intelligence solutions; and application and platform development, as well as application modernization, maintenance and support, and portfolio rationalization solutions. In addition, it operates Open Source Hub, an open source security and integrity solution; and provides cloud transformation, data center modernization, IT operation, and cloud advisory services. Further, the company offers cyber resiliency strategy, security assurance and data security, identity access management, and managed security, as well as governance, risk, and compliance solutions; and data and analytics advisory, data stack modernization, data science and machine learning, and data connector and certification solutions, as well as data governance, management, and security services. Additionally, it provides generative AI, enterprise integration strategy and advisory, API-led integration, managed integration, and migration services. It serves customers in the banking, financial services, insurance, healthcare, life sciences, consumer tech, industrial, software and hi-tech, and telecom and media sectors. The company was incorporated in 1990 and is based in Pune, India.",,"[{'maxAge': 1, 'name': 'Dr. Anand Suresh Deshpande Ph.D.', 'age': 61, 'title': 'Founder, Chairman & MD', 'yearBorn': 1962, 'fiscalYear': 2023, 'totalPay': 36400000, 'exercisedValue': 0, 'unexercisedValue': 0}, {'maxAge': 1, 'name': 'Mr. Sandeep Kumar Kalra', 'age': 52, 'title': 'CEO & Executive Director', 'yearBorn': 1971, 'fiscalYear': 2023, 'totalPay': 616560000, 'exercisedValue': 0, 'unexercisedValue': 0}, {'maxAge': 1, 'name': 'Mr. Sunil  Sapre', 'age': 59, 'title': 'CFO & Executive Director', 'yearBorn': 1964, 'fiscalYear': 2023, 'totalPay': 102190000, 'exercisedValue': 0, 'unexercisedValue': 0}, {'maxAge': 1, 'name': 'Mr. Amit Murari Atre', 'title': 'Company Secretary & Compliance Officer', 'fiscalYear': 2023, 'exercisedValue': 0, 'unexercisedValue': 0}, {'maxAge': 1, 'name': 'Mr. Mukesh  Agarwal', 'age': 49, 'title': 'Chief Planning Officer', 'yearBorn': 1974, 'fiscalYear': 2023, 'totalPay': 93560000, 'exercisedValue': 0, 'unexercisedValue': 0}, {'maxAge': 1, 'name': 'Sameer  Dixit', 'age': 49, 'title': 'Senior Vice President of Engineering', 'yearBorn': 1974, 'fiscalYear': 2023, 'totalPay': 72560000, 'exercisedValue': 0, 'unexercisedValue': 0}, {'maxAge': 1, 'name': 'Shreekanth  Joshi', 'age': 48, 'title': 'Vice President of Engineering', 'yearBorn': 1975, 'fiscalYear': 2023, 'totalPay': 84220000, 'exercisedValue': 0, 'unexercisedValue': 0}, {'maxAge': 1, 'name': 'Shailesh  Wadhankar', 'age': 48, 'title': 'Vice President of Engineering', 'yearBorn': 1975, 'fiscalYear': 2023, 'totalPay': 58520000, 'exercisedValue': 0, 'unexercisedValue': 0}, {'maxAge': 1, 'name': 'Ms. Dhanashree Ajit Bhat', 'title': 'Chief Operating Officer', 'fiscalYear': 2023, 'exercisedValue': 0, 'unexercisedValue': 0}, {'maxAge': 1, 'name': 'Sachin  Dewasthalee', 'age': 53, 'title': 'Group Head of Corporate Finance', 'yearBorn': 1970, 'fiscalYear': 2023, 'exercisedValue': 0, 'unexercisedValue': 0}]",1703980800.0,86400,2,8373.85,8332.35,8258.15,8448.0,8373.85,8332.35,8258.15,8448.0,44.0,0.0053,1706572800.0,0.2983,1.09,0.695,62.346252,364951,364951,505537,517192,517192,633980715008,3962.05,8830.0,6.683659,7207.671,5776.119,INR,606327341056,0.10855,46597788,75897200,0.34932998,0.42650002,76776304,658.912,12.677187,1680220800,1711843200,1703980800,0.202,10296829952,133.98,2:1,1425945600.0,6.392,38.878,0.7876226,0.19561028,32.0,1706572800.0,NSI,EQUITY,PERSISTENT.NS,PERSISTENT.NS,PERSISTENT SYSTEMS,Persistent Systems Limited,1270525500,Asia/Kolkata,IST,f729d63c-1ce5-3f9d-b741-e5b1e5f6ed9d,finmb_740158,19800000,8353.15,buy,11453469696,156.148,15595750400.0,5077250048.0,1.637,1.949,94855331840,10.505,1262.136,0.119119994,0.23756,4933941248.0,11614430208.0,0.195,0.152,0.28102,0.16442,0.14534001,INR,,,,,,,,151.18825,55.25,1.08,1200.0,600.0,879.7,847.0,2.1,33.0,44.0,0.005254453,,
PETRONET.NS,World Trade Centre,1st Floor Babar Road Barakhamba Lane,New Delhi,110001,India,91 11 2341 1411,91 11 2347 2550,https://petronetlng.in,Oil & Gas Refining & Marketing,oil-gas-refining-marketing,Oil & Gas Refining & Marketing,Energy,energy,Energy,"Petronet LNG Limited engages in the import, storage, regasification, and supply of liquefied natural gas (LNG) in India. It owns and operates a LNG import and regasification terminal with name plate capacity of 17.5 MMTPA located in Dahej, Gujarat; and a LNG terminal with name plate capacity of 5 MMTPA located in Kochi, Kerala. The company serves oil and gas entities, gas aggregators, petrochemical entities, refineries, city gas distribution entities, fertilizer and power generating entities, and other industrial entities. Petronet LNG Limited was incorporated in 1998 and is based in New Delhi, India.",523.0,"[{'maxAge': 1, 'name': 'Mr. Akshay Kumar Singh', 'age': 62, 'title': 'MD, CEO & Additional Executive Director', 'yearBorn': 1961, 'fiscalYear': 2023, 'totalPay': 22770905, 'exercisedValue': 0, 'unexercisedValue': 0}, {'maxAge': 1, 'name': 'Mr. Vinod Kumar Mishra', 'age': 59, 'title': 'Director of Finance, CFO & Executive Director', 'yearBorn': 1964, 'fiscalYear': 2023, 'totalPay': 16416553, 'exercisedValue': 0, 'unexercisedValue': 0}, {'maxAge': 1, 'name': 'Mr. Pramod  Narang', 'age': 60, 'title': 'Director of Technical & Additional Whole-Time Director', 'yearBorn': 1963, 'fiscalYear': 2023, 'totalPay': 14509532, 'exercisedValue': 0, 'unexercisedValue': 0}, {'maxAge': 1, 'name': 'Sanjiban Deb Roy', 'age': 51, 'title': 'CGM and VP of BIS & HR', 'yearBorn': 1972, 'fiscalYear': 2023, 'exercisedValue': 0, 'unexercisedValue': 0}, {'maxAge': 1, 'name': 'Sanjay Kumar Rastogi', 'age': 59, 'title': 'GGM and President of Technical & HSE', 'yearBorn': 1964, 'fiscalYear': 2023, 'exercisedValue': 0, 'unexercisedValue': 0}, {'maxAge': 1, 'name': 'Manoj Kumar Pawa', 'age': 57, 'title': 'Executive Director of Business Development', 'yearBorn': 1966, 'fiscalYear': 2023, 'exercisedValue': 0, 'unexercisedValue': 0}, {'maxAge': 1, 'name': 'Mr. Rakesh  Chawla', 'age': 55, 'title': 'GGM and President of Finance & Accounts', 'yearBorn': 1968, 'fiscalYear': 2023, 'exercisedValue': 0, 'unexercisedValue': 0}, {'maxAge': 1, 'name': 'Mr. Sanjay  Kumar', 'age': 55, 'title': 'GGM & President (Plant Head) - Dahej', 'yearBorn': 1968, 'fiscalYear': 2023, 'exercisedValue': 0, 'unexercisedValue': 0}, {'maxAge': 1, 'name': 'Peter  Fernandes', 'age': 56, 'title': 'CGM & VP of Projects', 'yearBorn': 1967, 'fiscalYear': 2023, 'exercisedValue': 0, 'unexercisedValue': 0}, {'maxAge': 1, 'name': 'Mr. Rajan  Kapur', 'age': 53, 'title': 'CGM, VP, Company Secretary & Compliance Officer', 'yearBorn': 1970, 'fiscalYear': 2023, 'exercisedValue': 0, 'unexercisedValue': 0}]",1703980800.0,86400,2,267.55,268.5,263.55,270.65,267.55,268.5,263.55,270.65,10.0,0.0374,1699574400.0,0.42790002,3.35,0.531,11.519691,7426620,7426620,7334146,14636495,14636495,403725385728,191.7,284.55,0.76448536,222.537,224.0565,INR,356974624768,0.0664,714773579,1500000000,0.50163,0.27136,1500280064,109.808,2.4506412,1680220800,1711843200,1703980800,0.014,35067998208,23.36,2:1,1499040000.0,0.676,7.2,0.23636782,0.19561028,7.0,1699574400.0,NSI,EQUITY,PETRONET.NS,PETRONET.NS,PETRONET LNG,Petronet LNG Limited,1080272700,Asia/Kolkata,IST,6318daf6-7028-394a-bf87-7d49a18f2e27,finmb_9112623,19800000,269.1,buy,78368595968,52.268,49580351488.0,31866200064.0,,,528100884480,19.33,351.975,,,,,0.014,-0.065,0.11574,0.09388,0.102390006,INR,,9.0,6.0,4.0,1.0,6.0,1706400000.0,11.981301,22.46,1.19,351.0,213.0,276.65,270.0,1.9,37.0,3.0,0.011212858,,
PIIND.NS,Vipul Square,"5th Floor B-Block Sushant Lok, Phase-I",Gurugram,122009,India,91 12 4679 0000,91 12 4408 1247,https://www.piindustries.com,Agricultural Inputs,agricultural-inputs,Agricultural Inputs,Basic Materials,basic-materials,Basic Materials,"PI Industries Limited manufactures and distributes agrochemicals in India, rest of Asia, North America, Europe, and internationally. The company offers agrochemicals, including insecticides, fungicides, and herbicides, as well as bio stimulants for rice, cotton, cole, tomato, chili, onion, brinjal, grapes, pomegranate, and apple corps. It also offers R&D services, which includes target discovery, molecule design, library synthesis, lead optimization, biological evaluation, and route synthesis; and custom synthesis and manufacturing solutions, such as process research and development, analytical method development, synthesis of reference standards, structure elucidation and synthesis of impurities, physio-chemical studies and 5-batch analysis under GLP conditions, scale-up studies, safety data generation, waste categorization and treatability studies, process/plant engineering, and large-scale commercial production. The company sells its products through distributors/dealers and retailers. PI Industries Limited was formerly known as Mewar Oil & General Mills Ltd. The company was incorporated in 1946 and is headquartered in Gurugram, India.",3384.0,"[{'maxAge': 1, 'name': 'Mr. Mayank  Singhal', 'age': 50, 'title': 'Executive Vice-Chairman & MD', 'yearBorn': 1973, 'fiscalYear': 2023, 'totalPay': 191206000, 'exercisedValue': 0, 'unexercisedValue': 0}, {'maxAge': 1, 'name': 'Mr. Rajnish  Sarna', 'age': 54, 'title': 'Joint MD, Chief Investor Relations Officer, President of IT, Finance & Whole-Time Director', 'yearBorn': 1969, 'fiscalYear': 2023, 'totalPay': 82032000, 'exercisedValue': 0, 'unexercisedValue': 0}, {'maxAge': 1, 'name': 'Dr. Atul Kumar Gupta', 'age': 53, 'title': 'CEO & C.S.M. - AgChem', 'yearBorn': 1970, 'fiscalYear': 2023, 'exercisedValue': 0, 'unexercisedValue': 0}, {'maxAge': 1, 'name': 'Mr. Manikantan  Viswanathan', 'title': 'Chief Financial Officer', 'fiscalYear': 2023, 'exercisedValue': 0, 'unexercisedValue': 0}, {'maxAge': 1, 'name': 'Mr. Pradeep Kumar Jain', 'age': 54, 'title': 'Head of Operations', 'yearBorn': 1969, 'fiscalYear': 2023, 'exercisedValue': 0, 'unexercisedValue': 0}, {'maxAge': 1, 'name': 'Dr. Alexander  Klausener', 'title': 'Chief Scientific Officer', 'fiscalYear': 2023, 'exercisedValue': 0, 'unexercisedValue': 0}, {'maxAge': 1, 'name': 'Mr. Atanu  Roy', 'title': 'Chief Information Officer', 'fiscalYear': 2023, 'exercisedValue': 0, 'unexercisedValue': 0}, {'maxAge': 1, 'name': 'Ms. Sonal Ramanand Tiwari', 'title': 'Company Secretary & Compliance Officer', 'fiscalYear': 2023, 'exercisedValue': 0, 'unexercisedValue': 0}, {'maxAge': 1, 'name': 'Mr. Samir  Dhaga', 'title': 'Chief Transformation Officer', 'fiscalYear': 2023, 'exercisedValue': 0, 'unexercisedValue': 0}, {'maxAge': 1, 'name': 'Mr. Anand Yeshwant Kamat', 'age': 58, 'title': 'Head Commercial & Supply Chain - CSM Agchem', 'yearBorn': 1965, 'fiscalYear': 2023, 'exercisedValue': 0, 'unexercisedValue': 0}]",1703980800.0,86400,2,3265.8,3265.8,3254.55,3390.0,3265.8,3265.8,3254.55,3390.0,11.0,0.0034,1691712000.0,0.1014,0.24,0.568,34.19497,291795,291795,467111,289263,289263,511570280448,2868.9,4011.15,7.0991282,3526.862,3567.4644,INR,483954393088,0.20756,80905154,151682000,0.46249,0.31632,157534000,526.098,6.4106874,1680220800,1711843200,1696032000,0.435,14956999680,98.63,5:1,1365724800.0,6.716,27.596,0.078213215,0.19561028,5.5,1691712000.0,NSI,EQUITY,PIIND.NS,PIIND.NS,PI INDUSTRIES,PI Industries Limited,1308109500,Asia/Kolkata,IST,66d0d598-1e5a-3da4-8e0c-f5222ec148d6,finmb_24275391,19800000,3372.65,buy,29556000768,194.805,17536999424.0,1808999936.0,2.489,3.4,72061001728,2.266,475.061,0.10107,0.2049,8823000064.0,18633000960.0,0.435,0.196,0.46305,0.24336,0.22253999,INR,,5.0,3.0,4.0,1.0,2.0,1706400000.0,29.205488,115.48,1.68,5160.0,2700.0,4070.58,4106.5,2.0,24.0,,,,
PIDILITIND.NS,Ramkrishna Mandir Road,Off. Mathuradas Vasanji Road Andheri (East),Mumbai,400059,India,91 22 2835 7000,91 22 2830 4482,https://www.pidilite.com,Specialty Chemicals,specialty-chemicals,Specialty Chemicals,Basic Materials,basic-materials,Basic Materials,"Pidilite Industries Limited, together with its subsidiaries, manufactures and sells consumer and specialty chemicals in India and internationally. The company operates in two segments Branded Consumer & Bazaar, and Business to Business. The Branded Consumer & Bazaar segment offers adhesives, sealants, art and craft materials; and construction and paint chemicals for use by carpenters, painters, plumbers, mechanics, households, students, offices, etc. The Business to Business segment provides industrial adhesives and resins, construction chemicals, organic pigments, pigment preparations, etc. for use in various industries, including packaging, joineries, textiles, paints, printing inks, paper, leather, etc. The company offers adhesives technologies, wood finishes, and paint; waterproofing services, automotive, technical textiles, and tile grouts; and mechanical, electrical, and plumbing solutions. Further, it sells its products primarily under the Fevicol, Fevicol MR, Dr. Fixit, Fevikwik, M-Seal, Fevistick, Fevicryl, Hobby Ideas, and other brands. The company was founded in 1959 and is headquartered in Mumbai, India.",7310.0,"[{'maxAge': 1, 'name': 'Mr. Madhukar Balvantray Parekh', 'age': 77, 'title': 'Executive Chairman of the Board', 'yearBorn': 1946, 'fiscalYear': 2023, 'totalPay': 36700000, 'exercisedValue': 0, 'unexercisedValue': 0}, {'maxAge': 1, 'name': 'Mr. Bharat Tilakraj Puri', 'age': 62, 'title': 'MD, CEO & Executive Director', 'yearBorn': 1961, 'fiscalYear': 2023, 'totalPay': 150900000, 'exercisedValue': 0, 'unexercisedValue': 0}, {'maxAge': 1, 'name': 'Mr. Ajay Balvantray Parekh', 'age': 64, 'title': 'Executive Vice Chairman', 'yearBorn': 1959, 'fiscalYear': 2023, 'totalPay': 17800000, 'exercisedValue': 0, 'unexercisedValue': 0}, {'maxAge': 1, 'name': 'Mr. Apurva Narendrakumar Parekh', 'age': 50, 'title': 'Executive Vice Chairman', 'yearBorn': 1973, 'fiscalYear': 2023, 'totalPay': 66000000, 'exercisedValue': 0, 'unexercisedValue': 0}, {'maxAge': 1, 'name': 'Mr. Sandeep  Batra', 'title': 'Executive Director of Finance & CFO', 'fiscalYear': 2023, 'totalPay': 19500000, 'exercisedValue': 0, 'unexercisedValue': 0}, {'maxAge': 1, 'name': 'Mr. Joseph  Varghese', 'title': 'Director of Operations & Director', 'fiscalYear': 2023, 'totalPay': 10100000, 'exercisedValue': 0, 'unexercisedValue': 0}, {'maxAge': 1, 'name': 'Mr. Sudhanshu  Vats', 'age': 55, 'title': 'Deputy MD & Director', 'yearBorn': 1968, 'fiscalYear': 2023, 'totalPay': 76400000, 'exercisedValue': 0, 'unexercisedValue': 0}, {'maxAge': 1, 'name': 'Mr. Priykant Chhotalal Patel', 'title': 'President', 'fiscalYear': 2023, 'exercisedValue': 0, 'unexercisedValue': 0}, {'maxAge': 1, 'name': 'Mr. Ramnarayan  Mohanty', 'title': 'President of Technology', 'fiscalYear': 2023, 'exercisedValue': 0, 'unexercisedValue': 0}, {'maxAge': 1, 'name': 'Ms. Manisha  Shetty', 'title': 'Company Secretary & Compliance Officer', 'fiscalYear': 2023, 'exercisedValue': 0, 'unexercisedValue': 0}]",1703980800.0,86400,2,2567.7,2571.05,2520.0,2583.15,2567.7,2571.05,2520.0,2583.15,11.0,0.0043,1690416000.0,0.32689998,0.51,0.188,75.29875,3417297,3417297,455042,934379,934379,1288331984896,2250.05,2805.0,10.585791,2628.721,2553.4507,INR,1280882638848,0.14064999,151847462,508608992,0.70115995,0.14877,508608992,147.995,17.115782,1680220800,1711843200,1703980800,0.678,17118199808,33.64,2:1,1268611200.0,10.525,50.341,0.109013915,0.19561028,11.0,1690416000.0,NSI,EQUITY,PIDILITIND.NS,PIDILITIND.NS,PIDILITE INDUSTRIE,Pidilite Industries Limited,1025495100,Asia/Kolkata,IST,0a39156e-3cde-3e8f-bdd2-b5be603cf3d8,finmb_878761,19800000,2533.05,hold,13385600000,26.326,25444274176.0,4158400000.0,,,121703899136,5.368,239.383,,,,,0.679,0.044,0.49573,0.20907,0.21181,INR,,8.0,10.0,10.0,1.0,10.0,1706400000.0,125.08889,20.25,,1330.0,920.0,1099.94,1065.0,2.8,18.0,,,,
PEL.NS,Piramal Tower Annexe,10th Floor Peninsula Corporate Park Ganpatrao Kadam Marg. Lower Parel,Mumbai,400 013,India,91 22 3802 3000,,https://www.piramal.com/businesses/piramal-enterprises/,Financial Conglomerates,financial-conglomerates,Financial Conglomerates,Financial Services,financial-services,Financial Services,"Piramal Enterprises Limited operates as a non-banking financial company in India. The company provides housing finance and other financing solutions, such as private equity, structured debt, senior secured debt, construction finance, and flexi lease rental discounting to real estate sector; and funding solutions to infrastructure, renewable energy, roads, industrials, auto components, and other sectors. It also operates distressed asset investing platform that invests in equity and/or debt in assets; provides life insurance services, as well as engages in fund management, property leasing, and manpower services businesses. The company was formerly known as Piramal Healthcare Limited and changed its name to Piramal Enterprises Limited in July 2012. Piramal Enterprises Limited was incorporated in 1947 and is headquartered in Mumbai, India.",12220.0,"[{'maxAge': 1, 'name': 'Mr. Ajay Gopikisan Piramal', 'age': 68, 'title': 'Executive Chairman', 'yearBorn': 1955, 'exercisedValue': 0, 'unexercisedValue': 0}, {'maxAge': 1, 'name': 'Mr. Vivek  Valsaraj', 'age': 50, 'title': 'President', 'yearBorn': 1973, 'exercisedValue': 0, 'unexercisedValue': 0}, {'maxAge': 1, 'name': 'Ms. Upma  Goel', 'title': 'Chief Financial Officer', 'exercisedValue': 0, 'unexercisedValue': 0}, {'maxAge': 1, 'name': 'Mr. Bipin  Singh', 'age': 54, 'title': 'BR Head, Company Secretary & Compliance Officer', 'yearBorn': 1969, 'exercisedValue': 0, 'unexercisedValue': 0}, {'maxAge': 1, 'name': 'Mr. Yesh  Nadkarni', 'title': 'Chief Executive Officer of Wholesale Lending-Piramal Enterprises Limited', 'exercisedValue': 0, 'unexercisedValue': 0}, {'maxAge': 1, 'name': 'Mr. Ravi  Singh', 'title': 'Head of Investor Relations', 'exercisedValue': 0, 'unexercisedValue': 0}, {'maxAge': 1, 'name': 'Mr. Shantanu Yeshwant Nalavadi', 'age': 52, 'title': 'Managing Director of India Resurgence Asset Management Business Pvt. Ltd. (IndiaRF)', 'yearBorn': 1971, 'exercisedValue': 0, 'unexercisedValue': 0}, {'maxAge': 1, 'name': 'Mr. Debopam  Chaudhuri', 'title': 'Chief Economist', 'exercisedValue': 0, 'unexercisedValue': 0}, {'maxAge': 1, 'name': 'Mr. Nitish  Bajaj', 'age': 50, 'title': 'Chief Executive Officer of Consumer Healthcare Division', 'yearBorn': 1973, 'exercisedValue': 0, 'unexercisedValue': 0}, {'maxAge': 1, 'name': 'Mr. Kalpesh  Kikani BE, CFA, MBA', 'age': 51, 'title': 'MD of Piramal Alternatives', 'yearBorn': 1972, 'exercisedValue': 0, 'unexercisedValue': 0}]",,86400,2,894.2,899.55,889.95,917.95,894.2,899.55,889.95,917.95,31.0,0.0347,1686873600.0,0.1911,2.06,0.687,,1017938,1017938,1391476,1514550,1514550,205814677504,630.45,1139.95,2.2170877,915.922,938.2185,INR,664168759296,-0.21722001,116484611,224664000,0.48765,0.25465,243848000,1209.412,0.7574755,1680220800,1711843200,1703980800,,-20164900864,-87.54,5:1,1104105600.0,7.155,,0.058475375,0.19561028,31.0,1686873600.0,NSI,EQUITY,PEL.NS,PEL.NS,PIRAMAL ENTERPRISE,Piramal Enterprises Limited,820554300,Asia/Kolkata,IST,c10527f2-0738-3c11-85ae-7c2e343e972a,finmb_32184,19800000,916.1,buy,39642398720,176.454,,497998987264.0,,,92831096832,173.458,395.526,,,,,,-0.106,0.99148005,,0.050029997,INR,,6.0,6.0,5.0,1.0,6.0,1706400000.0,6.707915,136.57,1.34,3479.61,3041.6,3260.6,3260.6,2.0,2.0,,,,
