IOC.NS,"3079/3, J.B. Tito Marg",Sadiq Nagar,New Delhi,110049,India,1800 2333 555,91 11 2626 0100,https://www.iocl.com,Oil & Gas Refining & Marketing,oil-gas-refining-marketing,Oil & Gas Refining & Marketing,Energy,energy,Energy,"Indian Oil Corporation Limited, together with its subsidiaries, engages in the refining, pipeline transportation, and marketing of petroleum products in India. The company operates through Sale of Petroleum Products, Sale of Petrochemicals, and Other Business. It is also involved in the exploration and production of crude oil and gas, and petrochemicals; and marketing of natural gas. The company's products include petrol/gasoline, diesel, lubricants and greases, auto gas, compressed natural gas, cooking gas, kerosene, piped natural gas, liquified petroleum gas (LPG), bulk/industrial fuels, aviation fuel, marine oils, and bitumen, as well as LPG services. In addition, the company offers special products, such as carbon black feedstock, raw petroleum coke, sulphur, paraffin wax, raw petroleum coke, jute batching oil, micro crystalline wax, mineral turpentine oil, toluene, propylene, benzene, and petcoke. Further, it engages in the explosives and cryogenic; wind and solar power generation; lube blending; bunkering; refining and pipeline consultancy; terminalling, retailing, and lubricants and base oil marketing activities, as well as provision of financial services. Additionally, the company operates Fuel@Call, a cloud-based technology platform for on-demand fuel delivery service for industrial and commercial customers; and provides non-fuel products comprising LPG stoves, hoses, kitchen aprons, gas lighters, and cylinder trolleys, as well as indoor solar cooking systems. The company operates through a network of approximately 9 refineries; approximately 17,000 kilometers of pipelines; approximately 36,285 fuel stations, including 11,732 Kisan Seva Kendra outlets; 45 CBG stations; 108 LPG bottling plants/terminals; 132 aviation fuel stations; 12,861 LPG distributors; 1,788 CNG stations; 10 lube blending plants; and 5,461 EV charging stations, including 76 battery swapping stations. Indian Oil Corporation Limited was founded in 1959 and is based in New Delhi, India.",31095.0,"[{'maxAge': 1, 'name': 'Mr. Kamal Kumar Gwalani', 'title': 'Compliance Officer & Company Secretary', 'fiscalYear': 2023, 'totalPay': 8600000, 'exercisedValue': 0, 'unexercisedValue': 0}, {'maxAge': 1, 'name': 'Mr. Satish Kumar Vaduguri', 'title': 'Director of Marketing & Whole-Time Director', 'fiscalYear': 2023, 'totalPay': 10227970, 'exercisedValue': 0, 'unexercisedValue': 0}, {'maxAge': 1, 'name': 'Mr. Ranjan Kumar Mohapatra', 'age': 58, 'title': 'Executive Director & Head of IndianOil Institute of Petroleum Management', 'yearBorn': 1965, 'fiscalYear': 2023, 'totalPay': 9291588, 'exercisedValue': 0, 'unexercisedValue': 0}, {'maxAge': 1, 'name': 'Mr. Sujoy  Choudhury', 'age': 58, 'title': 'Director of Planning & Business Development and Whole-Time Director', 'yearBorn': 1965, 'fiscalYear': 2023, 'totalPay': 9169253, 'exercisedValue': 0, 'unexercisedValue': 0}, {'maxAge': 1, 'name': 'Ms. Sukla  Mistry', 'age': 59, 'title': 'Director of Refineries & Whole-Time Director', 'yearBorn': 1964, 'fiscalYear': 2023, 'totalPay': 8956110, 'exercisedValue': 0, 'unexercisedValue': 0}, {'maxAge': 1, 'name': 'Mr. Anuj  Jain', 'age': 52, 'title': 'Director of Finance', 'yearBorn': 1971, 'fiscalYear': 2023, 'exercisedValue': 0, 'unexercisedValue': 0}, {'maxAge': 1, 'name': 'Mr. Anant Kumar Singh', 'age': 55, 'title': 'Chief Vigilance Officer', 'yearBorn': 1968, 'fiscalYear': 2023, 'exercisedValue': 0, 'unexercisedValue': 0}, {'maxAge': 1, 'name': 'Mr. Chandrasekaran Shankar Tennankore', 'title': 'Executive Director of Finance, Pipelines & Chief Risk Officer', 'fiscalYear': 2023, 'exercisedValue': 0, 'unexercisedValue': 0}, {'maxAge': 1, 'name': 'Mr. Nachimuthu  Senthil Kumar', 'age': 58, 'title': 'Director of Pipelines & Director', 'yearBorn': 1965, 'fiscalYear': 2023, 'exercisedValue': 0, 'unexercisedValue': 0}, {'maxAge': 1, 'name': 'Mr. Alok  Sharma', 'title': 'Director of Research & Development and Director', 'fiscalYear': 2023, 'exercisedValue': 0, 'unexercisedValue': 0}]",1703980800.0,86400,2,147.7,147.8,146.1,150.1,147.7,147.8,146.1,150.1,8.0,0.0542,1699574400.0,0.2351,6.84,0.756,4.3182487,27377474,27377474,32848785,35037879,35037879,2023736606720,75.75,152.2,0.25893077,127.084,100.698,INR,3082633871360,0.059970003,3373834530,13771599872,0.73387,0.13413,13771599872,121.223,1.2122287,1680220800,1711843200,1703980800,10.678,468706394112,34.03,3:2,1656547200.0,0.394,3.64,0.85087717,0.19561028,5.0,1699574400.0,NSI,EQUITY,IOC.NS,IOC.NS,INDIAN OIL CORP,Indian Oil Corporation Limited,829539900,Asia/Kolkata,IST,5c85b630-cee2-3375-ab0c-d2929d19072c,finmb_7844179,19800000,146.95,hold,136105402368,9.888,846776500224.0,1154181758976.0,,,7815743668224,67.495,569.143,,,,,10.714,-0.028,0.17215,0.108339995,0.05948,INR,,9.0,6.0,2.0,5.0,5.0,1706400000.0,9.444087,15.56,-1.17,191.0,85.0,132.91,132.5,2.8,32.0,,,,
IRCTC.NS,"Statesman House, B-148",11th Floor Barakhamba Road Connaught Place,New Delhi,110001,India,91 11 2331 1263,91 11 2331 1259,https://www.irctc.com,Railroads,railroads,Railroads,Industrials,industrials,Industrials,"Indian Railway Catering & Tourism Corporation Limited provides catering and hospitality, Internet ticketing, travel and tourism, and packaged drinking water services in India. It operates through four segments: Catering & Hospitality; Travel & Tourism; Internet Ticketing; and Packaged Drinking Water. The company offers mobile catering services, including Rajdhani, Shatabdi, and Duronto; mail express, train side vending, Gatiman, and Tejas and Vande Bharat; e-catering; and other catering services, such as food plaza, fast food units, refreshment rooms, Jan Ahaars, cell kitchen, base kitchen, executive lounges, retiring rooms, RYN/BNR hotels, and non-railway catering. In addition, the company offers tourism products and services comprising domestic tour packages, inbound tourist targeted tours, mass tourism, outbound tour packages, and air ticket and corporate travel; and other tourism activities, such as event management, booking of charter trains and coaches, hill and heritage charters, saloon tours and charters, online reservation and accommodation facilities, and adventure tourism. Further, it offers packaged drinking water under the Rail Neer name; and train ticket booking and travel insurance services, as well as operates irctctourism.com, a tourism portal. The company was incorporated in 1999 and is based in New Delhi, India.",1400.0,"[{'maxAge': 1, 'name': 'Mr. Ajit  Kumar', 'age': 59, 'title': 'CFO, Director of Finance & Director', 'yearBorn': 1964, 'fiscalYear': 2023, 'totalPay': 7209536, 'exercisedValue': 0, 'unexercisedValue': 0}, {'maxAge': 1, 'name': 'Dr. Lokiah  Ravikumar', 'age': 58, 'title': 'Director of Catering Services & Director', 'yearBorn': 1965, 'fiscalYear': 2023, 'totalPay': 630702, 'exercisedValue': 0, 'unexercisedValue': 0}, {'maxAge': 1, 'name': 'Mr. Sanjay Kumar Jain', 'title': 'Chairman & Managing Director (Additional Charge)', 'fiscalYear': 2023, 'exercisedValue': 0, 'unexercisedValue': 0}, {'maxAge': 1, 'name': 'Mr. Anil Kumar Sharma', 'title': 'Chief Investor Relations Officer & AGM of Finance', 'fiscalYear': 2023, 'exercisedValue': 0, 'unexercisedValue': 0}, {'maxAge': 1, 'name': 'Ms. Suman  Kalra', 'title': 'Company Secretary & Compliance Officer', 'fiscalYear': 2023, 'totalPay': 3446686, 'exercisedValue': 0, 'unexercisedValue': 0}, {'maxAge': 1, 'name': 'Mr. Kamlesh Kumar Mishra', 'age': 48, 'title': 'Director of Tourism & Marketing (Additional Charge) and Director', 'yearBorn': 1975, 'fiscalYear': 2023, 'exercisedValue': 0, 'unexercisedValue': 0}, {'maxAge': 1, 'name': 'Mr. Sandip  Trivedi', 'title': 'Group General Manager of HRD & Nodal Officer for CSR', 'fiscalYear': 2023, 'exercisedValue': 0, 'unexercisedValue': 0}, {'maxAge': 1, 'name': 'Mr. Rajesh  Rana', 'title': 'GM of Mobile Catering Services & Chief Risk Officer', 'fiscalYear': 2023, 'exercisedValue': 0, 'unexercisedValue': 0}]",1703980800.0,86400,2,964.05,968.9,965.0,981.9,964.05,968.9,965.0,981.9,5.0,0.0052,1700179200.0,0.4145,,0.483,73.47369,2254067,2254067,6346845,7780319,7780319,781760004096,557.1,1046.9,20.1475,850.08,704.85675,INR,762901364736,0.2735,293860731,800000000,0.62397,0.15377,841395968,35.54,27.495779,1680220800,1711843200,1696032000,0.304,10612211712,13.3,5:1,1635379200.0,19.661,57.176,0.53498924,0.19561028,2.5,1700179200.0,NSI,EQUITY,IRCTC.NS,IRCTC.NS,Indian Rail Tour Corp Ltd,Indian Railway Catering & Tourism Corporation Limited,1571024700,Asia/Kolkata,IST,cf6097b0-b9e9-3873-86f8-1100b5b42e61,finmb_26171986,19800000,977.2,hold,20263510016,25.306,13342920704.0,667966976.0,1.413,1.904,38801838080,2.347,48.535,0.16235,0.41751,3128875520.0,8822586368.0,0.305,0.235,0.39668,0.34387,0.35422,INR,,,,,,,,57.617928,16.96,0.97,1080.0,450.0,710.5,704.5,3.4,6.0,,,,
IGL.NS,IGL Bhawan,"Plot No. 4, Community Centre Sector 9 R K Puram",New Delhi,110022,India,91 11 4607 4607,91 11 2617 1860,https://www.iglonline.net,Utilities - Regulated Gas,utilities-regulated-gas,Utilities - Regulated Gas,Utilities,utilities,Utilities,"Indraprastha Gas Limited engages in the distribution of natural gas in India. The company supplies compressed natural gas (CNG) to the transport sector; and piped natural gas to domestic, commercial, and industrial sectors. It operates CNG stations, as well as steel pipeline and MDPE networks. The company serves households; hotels, restaurants, malls, commercial complexes, educational/religious institutions, and hospitals; and metal, textiles, food and beverages, pharmaceuticals, chemical, auto and ancillary, and packaging industries. Indraprastha Gas Limited was incorporated in 1998 and is headquartered in New Delhi, India.",687.0,"[{'maxAge': 1, 'name': 'Mr. Sunil Kumar Jain', 'age': 58, 'title': 'Senior VP, Compliance Officer & Company Secretary', 'yearBorn': 1965, 'exercisedValue': 0, 'unexercisedValue': 0}, {'maxAge': 1, 'name': 'Mr. Praveen Kumar Pandey BE (Mech.)', 'age': 60, 'title': 'Senior Vice President of O&M', 'yearBorn': 1963, 'exercisedValue': 0, 'unexercisedValue': 0}, {'maxAge': 1, 'name': 'Mr. Vinod Kumar Dhaaka', 'age': 59, 'title': 'Senior Vice President', 'yearBorn': 1964, 'exercisedValue': 0, 'unexercisedValue': 0}, {'maxAge': 1, 'name': 'Mr. Ajai  Tyagi', 'age': 54, 'title': 'Senior Vice President of Projects', 'yearBorn': 1969, 'exercisedValue': 0, 'unexercisedValue': 0}, {'maxAge': 1, 'name': 'Mr. Raman Kumar Srivastava', 'age': 51, 'title': 'Senior VP of Regulatory, Corporate Affairs & Risk Management and Fire & Safety Department', 'yearBorn': 1972, 'exercisedValue': 0, 'unexercisedValue': 0}, {'maxAge': 1, 'name': 'Mr. Pawan  Kumar', 'title': 'Director of Commercial & Director', 'exercisedValue': 0, 'unexercisedValue': 0}, {'maxAge': 1, 'name': 'Mr. Ujwal  Bhandari', 'age': 60, 'title': 'Senior Vice President', 'yearBorn': 1963, 'exercisedValue': 0, 'unexercisedValue': 0}, {'maxAge': 1, 'name': 'Mr. Sanjeev Kumar Bhatia', 'age': 57, 'title': 'Vice President', 'yearBorn': 1966, 'exercisedValue': 0, 'unexercisedValue': 0}, {'maxAge': 1, 'name': 'Mr. Bhudev  Singh', 'age': 55, 'title': 'Vice President', 'yearBorn': 1968, 'exercisedValue': 0, 'unexercisedValue': 0}, {'maxAge': 1, 'name': 'Mr. Amit  Dixit', 'age': 54, 'title': 'Vice President', 'yearBorn': 1969, 'exercisedValue': 0, 'unexercisedValue': 0}]",,86400,2,425.6,426.05,424.35,432.8,425.6,426.05,424.35,432.8,14.0,0.032899998,1700006400.0,0.6111,1.25,0.418,15.465325,1591602,1591602,2558417,3597381,3597381,301598932992,375.7,515.7,2.1376548,412.418,446.52325,INR,275110100992,0.13813,315664233,700001024,0.5003,0.27704,751142016,128.736,3.3432763,1680220800,1711843200,1703980800,0.427,19487899648,27.83,5:1,1510185600.0,1.95,12.081,0.003891945,0.19561028,4.0,1700006400.0,NSI,EQUITY,IGL.NS,IGL.NS,INDRAPRASTHA GAS,Indraprastha Gas Limited,1072410300,Asia/Kolkata,IST,27f91145-7a3a-3e8b-8284-199d35cacf81,finmb_1271089,19800000,430.4,buy,27855099904,39.683,22772199424.0,843600000.0,,,141088702464,0.937,201.452,,,,,0.423,-0.042,0.26444,0.16139999,0.12946999,INR,,9.0,5.0,1.0,8.0,4.0,1706400000.0,16.00595,26.89,0.76,604.0,350.0,460.9,460.0,2.5,31.0,4.0,0.009398496,,
INDUSTOWER.NS,Building No. 10,Tower-A 4th Floor DLF Cyber City,Gurugram,122002,India,91 12 4429 6766,91 12 4428 9333,https://www.industowers.com,Telecom Services,telecom-services,Telecom Services,Communication Services,communication-services,Communication Services,"Indus Towers Limited operates and maintains wireless communication towers and related infrastructures for various telecom service providers in India. The company offers ground base towers, smart poles, roof-top tower, small cells, and fibre backhauls; and offers energy supply to telecom equipment, as well as acquires the requisite space from residential and commercial property owners and landlords for placing passive infrastructure at strategic locations. It also provides smart digital infrastructure, which includes smart poles LED lights, CCTV cameras, variable digital messaging board, environment sensors, and city public Wi-Fi services including fiber services. The company was formerly known as Bharti Infratel Limited and changed its name to Indus Towers Limited in December 2020. Indus Towers Limited was incorporated in 2006 and is headquartered in Gurugram, India.",3500.0,"[{'maxAge': 1, 'name': 'Mr. Prachur  Sah', 'age': 46, 'title': 'CEO, MD & Additional Director', 'yearBorn': 1977, 'fiscalYear': 2023, 'totalPay': 28742825, 'exercisedValue': 0, 'unexercisedValue': 0}, {'maxAge': 1, 'name': 'Mr. Vikas  Poddar', 'title': 'Chief Financial Officer', 'fiscalYear': 2023, 'exercisedValue': 0, 'unexercisedValue': 0}, {'maxAge': 1, 'name': 'Mr. Tejinder  Kalra', 'title': 'Chief Operating Officer', 'fiscalYear': 2023, 'exercisedValue': 0, 'unexercisedValue': 0}, {'maxAge': 1, 'name': 'Mr. R.  Ramanujam', 'title': 'Chief Technology Officer', 'fiscalYear': 2023, 'exercisedValue': 0, 'unexercisedValue': 0}, {'maxAge': 1, 'name': 'Ms. Neeti  Wahi', 'title': 'Chief Digital & Information Technology Officer', 'fiscalYear': 2023, 'exercisedValue': 0, 'unexercisedValue': 0}, {'maxAge': 1, 'name': 'Mr. Dheeraj  Agarwal C.F.A.', 'title': 'Chief Investor Relation Officer', 'fiscalYear': 2023, 'exercisedValue': 0, 'unexercisedValue': 0}, {'maxAge': 1, 'name': 'Mr. Rajiv  Arora', 'age': 52, 'title': 'General Counsel, Chief of Legal, Regulatory & Corporate Affairs', 'yearBorn': 1971, 'fiscalYear': 2023, 'exercisedValue': 0, 'unexercisedValue': 0}, {'maxAge': 1, 'name': 'Ms. Samridhi  Rodhe', 'title': 'Company Secretary & Compliance Officer', 'fiscalYear': 2023, 'exercisedValue': 0, 'unexercisedValue': 0}, {'maxAge': 1, 'name': 'Mr. Prem  Subedi', 'title': 'Head of Group Corporate Communications', 'fiscalYear': 2023, 'exercisedValue': 0, 'unexercisedValue': 0}, {'maxAge': 1, 'name': 'Mr. Pushkar Singh Kataria', 'age': 48, 'title': 'Chief Human Resources Officer', 'yearBorn': 1975, 'fiscalYear': 2023, 'exercisedValue': 0, 'unexercisedValue': 0}]",1703980800.0,86400,2,229.95,230.1,220.7,230.75,229.95,230.1,220.7,230.75,,,1652400000.0,,5.97,0.243,10.711873,13073886,13073886,11731108,18707771,18707771,597911076864,135.8,236.0,2.123241,201.439,178.4315,INR,796110880768,0.19823,702650854,2693900032,0.73889,0.17323999,2745880064,93.563,2.3721983,1680220800,1711843200,1703980800,,55822000128,20.72,,,2.827,6.77,0.59300315,0.19561028,11.0,1652400000.0,NSI,EQUITY,INDUSTOWER.NS,INDUSTOWER.NS,INDUS TOWERS LIMITED,Indus Towers Limited,1356666300,Asia/Kolkata,IST,548f29ef-f4ac-3ddb-97a7-40e262cabdb3,finmb_36435064,19800000,221.95,hold,1408000000,0.523,117590999040.0,199606992896.0,0.661,1.079,281603014656,79.193,104.491,0.10520001,0.24841999,15728624640.0,108686000128.0,,0.064,0.53133,0.41758,0.28141,INR,,1.0,6.0,7.0,8.0,6.0,1706400000.0,10.518957,21.1,-10.8,400.0,180.0,258.44,250.0,2.6,25.0,,,,
INDUSINDBK.NS,One World Centre,"Tower 1, 8th Floor 841, Senapati Bapat Marg Prabhadevi (West)",Mumbai,400013,India,91 22 2423 1999,91 22 2423 1998,https://www.indusind.com,Banks - Regional,banks-regional,Banks - Regional,Financial Services,financial-services,Financial Services,"IndusInd Bank Limited provides various banking products and services to individuals, NRIs, business owners, corporates, and government and financial institutions. It operates through four segments: Treasury, Corporate/Wholesale Banking, Retail Banking, and Other Banking Operations. The company offers current, savings, defense, and corporate salary; and fixed and FCNR, sweep in/out deposits, senior citizen schemes, young saver deposits, and recurring and RFC deposits, as well as Rupee multiplier products. It also provides home, personal, car, two wheeler, gold, agricultural, and medical equipment loans, as well as loans against property and securities; micro-finance loans; MSME loans; business loans; loans to merchants and retailers; personal and professional loans; and loan on credit cards. In addition, the company offers transaction banking services, including letters of credit/guarantees, structured trade and export finance, and import finance solutions, as well as cash management and remittance services; investment products, such as demat account, mutual fund, gold bond, national pension system, and equity trading; project finance, supply chain financing; investment advisory, strategic M&A, and other advisory services; and health, general, life, and card protection insurance. Further, it provides debit, credit, forex, and commercial cards; individual outward remittances, foreign currency bank notes and demand drafts, and travelers cheques; financial inclusion products; trade and foreign exchange accounts; real estate developer financing and bullion services; correspondent banking services; and forex and derivative desk, information and advisory, and remittances through forex channel services. IndusInd Bank Limited was incorporated in 1994 and is based in Mumbai, India. IndusInd Bank Limited was incorporated in 1994 and is based in Mumbai, India.",38179.0,"[{'maxAge': 1, 'name': 'Mr. Sumant  Kathpalia', 'age': 62, 'title': 'MD, CEO & Additional Director', 'yearBorn': 1961, 'fiscalYear': 2023, 'totalPay': 75000000, 'exercisedValue': 0, 'unexercisedValue': 0}, {'maxAge': 1, 'name': 'Mr. Gobind  Jain', 'title': 'Chief Financial Officer', 'fiscalYear': 2023, 'exercisedValue': 0, 'unexercisedValue': 0}, {'maxAge': 1, 'name': 'Mr. Arun  Khurana', 'title': 'Deputy CEO & Whole time Director and Head of Gems,Jewellery business', 'fiscalYear': 2023, 'exercisedValue': 0, 'unexercisedValue': 0}, {'maxAge': 1, 'name': 'Mr. Samir  Dewan', 'title': 'Head of Affluent Banking & International Business', 'fiscalYear': 2023, 'exercisedValue': 0, 'unexercisedValue': 0}, {'maxAge': 1, 'name': 'Mr. K. S. Sridhar', 'title': 'President', 'fiscalYear': 2023, 'exercisedValue': 0, 'unexercisedValue': 0}, {'maxAge': 1, 'name': 'Mr. Bhavesh  Lakhani', 'title': 'Chief Technology Officer', 'fiscalYear': 2023, 'exercisedValue': 0, 'unexercisedValue': 0}, {'maxAge': 1, 'name': 'Mr. Indrajit  Yadav', 'title': 'Head of Investor Relations & Strategy', 'fiscalYear': 2023, 'exercisedValue': 0, 'unexercisedValue': 0}, {'maxAge': 1, 'name': 'Mr. Sachin Shamkant Patange', 'age': 55, 'title': 'Chief Compliance Officer', 'yearBorn': 1968, 'fiscalYear': 2023, 'exercisedValue': 0, 'unexercisedValue': 0}, {'maxAge': 1, 'name': 'Mr. Soumitra  Sen', 'title': 'Head of Consumer Bank & Marketing', 'fiscalYear': 2023, 'exercisedValue': 0, 'unexercisedValue': 0}, {'maxAge': 1, 'name': 'Mr. Zubin  Mody', 'title': 'Chief Human Resources Officer', 'fiscalYear': 2023, 'exercisedValue': 0, 'unexercisedValue': 0}]",1703980800.0,86400,2,1519.9,1519.2,1507.15,1548.0,1519.9,1519.2,1507.15,1548.0,14.0,0.0092,1685664000.0,0.12560001,0.54,1.198,13.750897,3867869,3867869,3960219,6671760,6671760,1193716482048,990.0,1694.5,4.781299,1555.263,1416.4725,INR,1194314825728,0.34733,622210931,778147008,0.24163,0.31695,778147008,752.013,2.0399249,1680220800,1711843200,1703980800,0.172,86715981824,111.56,,,4.784,,0.45884728,0.19561028,14.0,1685664000.0,NSI,EQUITY,INDUSINDBK.NS,INDUSINDBK.NS,INDUSIND BANK LTD,IndusInd Bank Limited,1025495100,Asia/Kolkata,IST,9781daee-0bea-3be5-a327-74d3f4bfb8e7,finmb_2985281,19800000,1534.05,buy,403760185344,519.285,,405304508416.0,,,249663619072,,321.578,,,,,0.168,0.221,,,0.45715,INR,,4.0,1.0,6.0,1.0,1.0,1706400000.0,15.883723,96.58,0.94,2450.0,1325.0,2112.73,2120.0,1.8,49.0,,,,
NAUKRI.NS,"B-8, Sector-132",,Noida,201304,India,91 12 0308 2000,91 12 0308 2095,https://www.infoedge.in,Internet Content & Information,internet-content-information,Internet Content & Information,Communication Services,communication-services,Communication Services,"Info Edge (India) Limited operates as an online classifieds company in the areas of recruitment, matrimony, real estate, and education and related services in India and internationally. It operates through Recruitment Solutions, 99acres, and Other segments. The company offers recruitment services through naukri.com, an online job website for job seekers and corporate customers, including hiring consultants; firstnaukri.com, a job search network for college students and recent graduates; naukrigulf.com, a website catering to Gulf markets; and quadranglesearch.com, a site that provides off-line placement services to middle and senior management, as well as operates other brands, that includes Highorbit/iimjobs.com, zwayam.com, hirist.com, doselect.com, ambitionbox.com, bigshyft.com, and jobhai.com. It also provides 99acres.com, which offers listing of properties for sale, purchase, and rent; Jeevansathi.com, an online matrimonial platform; and shiksha.com, an education classified website that helps students to decide their undergraduate and postgraduate options by providing useful information on careers, exams, colleges, and courses, as well as operates multiple dating platforms on the web through its mobile apps Aisle, Anbe, Arike, Neetho, and Neene. In addition, the company provides internet, computer, and electronics data processing services; and software development, consultancy, technical support for consumer companies, SAAS providers, and other services in the field of information technology and product development, as well as brokerage services in the real estate sector. Further, it acts as an investment adviser and manager, financial and management consultant, and sponsor of alternative investment funds, as well as provides advertising solutions for colleges and universities. Info Edge (India) Limited was incorporated in 1995 and is based in Noida, India.",5268.0,"[{'maxAge': 1, 'name': 'Mr. Hitesh  Oberoi', 'age': 51, 'title': 'Co-Promoter, MD, CEO & Director', 'yearBorn': 1972, 'fiscalYear': 2023, 'totalPay': 27230000, 'exercisedValue': 0, 'unexercisedValue': 0}, {'maxAge': 1, 'name': 'Mr. Sanjeev  Bikhchandani', 'age': 60, 'title': 'Founder, Promoter & Executive Vice Chairman', 'yearBorn': 1963, 'fiscalYear': 2023, 'totalPay': 28100000, 'exercisedValue': 0, 'unexercisedValue': 0}, {'maxAge': 1, 'name': 'Mr. Chintan Arvind Thakkar', 'age': 57, 'title': 'CFO & Whole Time Director', 'yearBorn': 1966, 'fiscalYear': 2023, 'totalPay': 32990000, 'exercisedValue': 0, 'unexercisedValue': 0}, {'maxAge': 1, 'name': 'Ms. Jaya  Bhatia', 'title': 'Company Secretary & Compliance Officer', 'fiscalYear': 2023, 'exercisedValue': 0, 'unexercisedValue': 0}, {'maxAge': 1, 'name': 'Shailesh  Chandra', 'age': 49, 'title': 'Executive Vice President of Operations', 'yearBorn': 1974, 'fiscalYear': 2023, 'exercisedValue': 0, 'unexercisedValue': 0}, {'maxAge': 1, 'name': 'Ms. Sumeet  Singh', 'age': 49, 'title': 'Chief Marketing Officer', 'yearBorn': 1974, 'fiscalYear': 2023, 'exercisedValue': 0, 'unexercisedValue': 0}, {'maxAge': 1, 'name': 'Ms. Sharmeen  Khalid', 'age': 51, 'title': 'Chief Human Resources Officer', 'yearBorn': 1972, 'fiscalYear': 2023, 'exercisedValue': 0, 'unexercisedValue': 0}, {'maxAge': 1, 'name': 'Mr. Shalabh  Nigam', 'age': 50, 'title': 'Executive Vice President of New Projects', 'yearBorn': 1973, 'fiscalYear': 2023, 'exercisedValue': 0, 'unexercisedValue': 0}, {'maxAge': 1, 'name': 'Mr. Vivek  Jain', 'age': 49, 'title': 'Chief Business Officer - Shiksha & FF', 'yearBorn': 1974, 'fiscalYear': 2023, 'exercisedValue': 0, 'unexercisedValue': 0}, {'maxAge': 1, 'name': 'Mr. Maneesh  Upadhyaya', 'age': 45, 'title': 'Chief Business Officer of 99Acres.Com', 'yearBorn': 1978, 'fiscalYear': 2023, 'exercisedValue': 0, 'unexercisedValue': 0}]",1703980800.0,86400,2,4892.7,4885.0,4872.0,5050.0,4892.7,4885.0,4872.0,5050.0,20.0,0.0041,1700179200.0,0.374,0.3,0.963,,308421,308421,294119,278523,278523,649666494464,3308.2,5404.4,26.559322,4976.488,4459.6445,INR,625179426816,-0.01048,71762768,129116000,0.46817002,0.33551997,129116000,1527.085,3.2949378,1680220800,1711843200,1696032000,0.991,-256260000,-1.96,2:1,1340323200.0,25.558,83.888,0.34785128,0.19561028,10.0,1700179200.0,NSI,EQUITY,NAUKRI.NS,NAUKRI.NS,INFO EDGE,Info Edge (India) Limited,1164080700,Asia/Kolkata,IST,6de9fbe5-1441-33a9-ad63-118d39f01eed,finmb_10930183,19800000,5031.65,hold,40575209472,314.316,7452550144.0,2742419968.0,3.223,3.273,24460959744,1.302,189.584,0.02082,-0.0038400001,6266016256.0,6120200192.0,0.99,0.036,0.52588004,0.30466998,0.28555,INR,,4.0,8.0,7.0,1.0,8.0,1706400000.0,70.76864,71.1,-3.11,6220.0,3100.0,4768.95,4908.5,2.6,22.0,19.0,0.0038833362,,
