,address1,address2,city,zip,country,phone,fax,website,industry,industryKey,industryDisp,sector,sectorKey,sectorDisp,longBusinessSummary,fullTimeEmployees,companyOfficers,compensationAsOfEpochDate,maxAge,priceHint,previousClose,open,dayLow,dayHigh,regularMarketPreviousClose,regularMarketOpen,regularMarketDayLow,regularMarketDayHigh,dividendRate,dividendYield,exDividendDate,payoutRatio,fiveYearAvgDividendYield,beta,trailingPE,volume,regularMarketVolume,averageVolume,averageVolume10days,averageDailyVolume10Day,marketCap,fiftyTwoWeekLow,fiftyTwoWeekHigh,priceToSalesTrailing12Months,fiftyDayAverage,twoHundredDayAverage,currency,enterpriseValue,profitMargins,floatShares,sharesOutstanding,heldPercentInsiders,heldPercentInstitutions,impliedSharesOutstanding,bookValue,priceToBook,lastFiscalYearEnd,nextFiscalYearEnd,mostRecentQuarter,earningsQuarterlyGrowth,netIncomeToCommon,trailingEps,lastSplitFactor,lastSplitDate,enterpriseToRevenue,enterpriseToEbitda,52WeekChange,SandP52WeekChange,lastDividendValue,lastDividendDate,exchange,quoteType,symbol,underlyingSymbol,shortName,longName,firstTradeDateEpochUtc,timeZoneFullName,timeZoneShortName,uuid,messageBoardId,gmtOffSetMilliseconds,currentPrice,recommendationKey,totalCash,totalCashPerShare,ebitda,totalDebt,quickRatio,currentRatio,totalRevenue,debtToEquity,revenuePerShare,returnOnAssets,returnOnEquity,freeCashflow,operatingCashflow,earningsGrowth,revenueGrowth,grossMargins,ebitdaMargins,operatingMargins,financialCurrency,trailingPegRatio,auditRisk,boardRisk,compensationRisk,shareHolderRightsRisk,overallRisk,governanceEpochDate,forwardPE,forwardEps,pegRatio,targetHighPrice,targetLowPrice,targetMeanPrice,targetMedianPrice,recommendationMean,numberOfAnalystOpinions,trailingAnnualDividendRate,trailingAnnualDividendYield,ask,bid
AARTIIND.NS,"71, Udyog Kshetra","2nd Floor Mulund-Goregaon Link Road, L.B.S. Marg Mulund (West)",Mumbai,400080,India,91 22 6797 6666,91 22 2565 3234,https://www.aarti-industries.com,Specialty Chemicals,specialty-chemicals,Specialty Chemicals,Basic Materials,basic-materials,Basic Materials,"Aarti Industries Limited manufactures and sells specialty chemicals and pharmaceuticals in India. The company offers di chloro benzene, nitro chloro and nitro benzene, nitro toluenes, sulphur, and other organic and inorganic products that are used in various processes, such as chlorination, nitration, hydrogenation, ammonolysis, halex, dinitro chlorination, alkylation, hydrolysis, methoxylation, esterification, diazotization, sulphonation, condensation, n-alkylation, and oxidation. It also provides end use products comprising dyes, basic pharma, pigments, agro chemicals, polymers, fertilizers, UV absorbers, plasticizers, specialty chemicals, flavour fragrance and food beverage products, and refinery and oil field chemicals, as well as intermediates for the manufacture of pharmaceuticals, agri-products, polymers, additives, pigments, and dyes. In addition, the company offers other specialty chemical products, such as single super phosphate, export grade calcium chloride granules, fuel additives, and phthalates; and sulphuric acid products. It also exports its products to approximately 60 countries in the United States, Europe, China, Japan, and internationally. The company was incorporated in 1984 and is headquartered in Mumbai, India.",6185.0,"[{'maxAge': 1, 'name': 'Mr. Rajendra Vallabhaji Gogri', 'age': 64, 'title': 'Chairman & MD', 'yearBorn': 1959, 'fiscalYear': 2023, 'totalPay': 80600000, 'exercisedValue': 0, 'unexercisedValue': 0}, {'maxAge': 1, 'name': 'Mr. Rashesh Chandrakant Gogri', 'age': 49, 'title': 'Vice Chairman & MD', 'yearBorn': 1974, 'fiscalYear': 2023, 'totalPay': 80600000, 'exercisedValue': 0, 'unexercisedValue': 0}, {'maxAge': 1, 'name': 'Mr. Parimal Hasmukhlal Desai', 'age': 74, 'title': 'Executive Director', 'yearBorn': 1949, 'fiscalYear': 2023, 'totalPay': 18000000, 'exercisedValue': 0, 'unexercisedValue': 0}, {'maxAge': 1, 'name': 'Mr. Manoj Murjibhai Chheda B.Com', 'age': 61, 'title': 'Executive Director', 'yearBorn': 1962, 'fiscalYear': 2023, 'totalPay': 18000000, 'exercisedValue': 0, 'unexercisedValue': 0}, {'maxAge': 1, 'name': 'Mr. Renil Rajendra Gogri', 'age': 36, 'title': 'Executive Director', 'yearBorn': 1987, 'fiscalYear': 2023, 'totalPay': 30400000, 'exercisedValue': 0, 'unexercisedValue': 0}, {'maxAge': 1, 'name': 'Mr. Chandrakant Vallabhaji Gogri (UDCT, B.E. (Chem), DBM, Mumbai)', 'age': 77, 'title': 'Founder & Chairman Emeritus', 'yearBorn': 1946, 'fiscalYear': 2023, 'totalPay': 523945, 'exercisedValue': 0, 'unexercisedValue': 0}, {'maxAge': 1, 'name': 'Mr. Chetan Bipin Gandhi CA', 'title': 'Chief Financial Officer', 'fiscalYear': 2023, 'exercisedValue': 0, 'unexercisedValue': 0}, {'maxAge': 1, 'name': 'Mr. Shyam  Dhekekar', 'age': 47, 'title': 'Senior Vice President of Process & Technology', 'yearBorn': 1976, 'fiscalYear': 2023, 'exercisedValue': 0, 'unexercisedValue': 0}, {'maxAge': 1, 'name': 'Dr. Prashant V. Potnis', 'title': 'Chief Scientific Officer', 'fiscalYear': 2023, 'exercisedValue': 0, 'unexercisedValue': 0}, {'maxAge': 1, 'name': 'Mr. Raj Kumar Sarraf', 'title': 'Compliance Officer & Company Secretary', 'fiscalYear': 2023, 'exercisedValue': 0, 'unexercisedValue': 0}]",1703980800.0,86400,2,633.55,634.0,631.0,660.0,633.55,634.0,631.0,660.0,4.0,0.0063,1690502400.0,0.2033,0.41,0.694,53.628963,1512998,1512998,2517021,4160897,4160897,242188255232,438.0,691.75,3.9122062,601.072,520.9517,INR,267662393344,0.07192,200847920,362504000,0.43893,0.23129,367452992,138.159,4.7705903,1680220800,1711843200,1696032000,-0.269,4452299776,12.29,2:1,1624320000.0,4.324,27.681,0.19797671,0.19561028,1.5,1690502400.0,NSI,EQUITY,AARTIIND.NS,AARTIIND.NS,AARTI IND LTD,Aarti Industries Limited,1025495100,Asia/Kolkata,IST,3556d1e1-3349-323d-8986-45585f3dde37,finmb_9454685,19800000,659.1,none,4329999872,11.896,9669499904.0,32070000640.0,0.476,1.058,61905801216,63.757,171.115,0.04382,0.09162,976649984.0,17707999232.0,-0.271,-0.137,0.38664,0.15619999,0.09696999,INR,,,,,,,,,,,,,,,,,,,,
ABB.NS,"Plot No. 5 & 6, 2nd Stage",Disha - 3rd Floor Peenya Industrial Area IV Peenya,Bengaluru,560058,India,91 80 2294 9150,91 80 2294 9148,https://new.abb.com/indian-subcontinent,Specialty Industrial Machinery,specialty-industrial-machinery,Specialty Industrial Machinery,Industrials,industrials,Industrials,"ABB India Limited develops and sells products and system solutions to utilities, industries, channel partners, and original equipment manufacturers in India and internationally. The company operates through Motion, Robotics and Discrete Automation, Electrification, and Process Automation segments. The Motion segment produces and provides motors, generators, and drives that provide power, motion, and control for a range of automation applications; and offers solutions and related services. The Robotics and Discrete Automation segment provides value-added solutions in robotics, machine, and factory automation. The Electrification segment offers a range of digital and connected solutions for low- and medium-voltage applications, including EV infrastructure, modular substations, distribution automation, power protection, wiring accessories, switchgear, enclosures, cabling, sensing, and control products. The Process Automation segment provides products, systems, and services, such as turnkey engineering, control systems, measurement products, life cycle services, outsourced maintenance, and industry specific products for the optimization of the productivity of industrial processes in oil and gas, power, chemicals and pharmaceuticals, pulp and paper, metals and minerals, marine, and ports industries. The company was formerly known as ABB Limited and changed its name to ABB India Limited in June 2013. ABB India Limited was incorporated in 1949 and is based in Bengaluru, India. ABB India Limited is a subsidiary of ABB Asea Brown Boveri Ltd.",,"[{'maxAge': 1, 'name': 'Mr. Sanjeev  Sharma', 'age': 58, 'title': 'MD & Director', 'yearBorn': 1965, 'fiscalYear': 2022, 'totalPay': 74128000, 'exercisedValue': 0, 'unexercisedValue': 0}, {'maxAge': 1, 'name': 'Mr. T. K. Sridhar', 'title': 'CFO & Chief Investor Relations Officer', 'fiscalYear': 2022, 'totalPay': 17153930, 'exercisedValue': 0, 'unexercisedValue': 0}, {'maxAge': 1, 'name': 'Mr. Trivikram  Guda', 'title': 'Regional General Counsel, Compliance Officer & Company Secretary', 'fiscalYear': 2022, 'exercisedValue': 0, 'unexercisedValue': 0}, {'maxAge': 1, 'name': 'Mr. Raman Kumar Singh', 'title': 'Country Human Resources Officer', 'fiscalYear': 2022, 'exercisedValue': 0, 'unexercisedValue': 0}, {'maxAge': 1, 'name': 'Mr. Nuguri  Venu', 'title': 'Head of Power Grids Division - South Asia', 'fiscalYear': 2022, 'exercisedValue': 0, 'unexercisedValue': 0}, {'maxAge': 1, 'name': 'Mr. G. N. V. Subba Rao', 'title': 'Head of India Centre for Global R&D', 'fiscalYear': 2022, 'exercisedValue': 0, 'unexercisedValue': 0}, {'maxAge': 1, 'name': 'Mr. Sanjeev  Arora', 'title': 'President of Motion', 'fiscalYear': 2022, 'exercisedValue': 0, 'unexercisedValue': 0}, {'maxAge': 1, 'name': 'Mr. Subrata  Karmakar', 'title': 'President of Robotics & Discrete Automation', 'fiscalYear': 2022, 'exercisedValue': 0, 'unexercisedValue': 0}, {'maxAge': 1, 'name': 'Mr. G.  Balaji', 'title': 'Head of Energy Division Process Automation', 'fiscalYear': 2022, 'exercisedValue': 0, 'unexercisedValue': 0}, {'maxAge': 1, 'name': 'Mr. Kiran  Dutt', 'title': 'President of Electrification Business', 'fiscalYear': 2022, 'exercisedValue': 0, 'unexercisedValue': 0}]",1672444800.0,86400,2,4729.75,4749.0,4631.0,4762.75,4729.75,4749.0,4631.0,4762.75,5.5,0.0011999999,1692921600.0,0.0964,0.33,0.597,81.62852,292816,292816,234159,174169,174169,1001964765184,2752.05,4990.05,9.904811,4674.106,4303.7383,INR,949091565568,0.119490005,52486856,211908000,0.75,0.10102,214480000,253.325,18.441133,1696032000,1727654400,1696032000,0.837,12088899584,57.23,5:1,1182988800.0,9.382,64.844,0.6957979,0.19561028,5.5,1692921600.0,NSI,EQUITY,ABB.NS,ABB.NS,ABB INDIA LTD,ABB India Limited,1025495100,Asia/Kolkata,IST,333b2b94-c2eb-37ab-8862-a2c20b8cb33b,finmb_878520,19800000,4671.6,hold,41503399936,195.811,14636574720.0,417700000.0,,,101159403520,0.778,477.342,,,,,0.835,0.306,0.35957,0.14468999,0.14741999,INR,,3.0,2.0,3.0,5.0,1.0,1706400000.0,73.47594,63.58,2.72,6167.0,1967.0,4463.68,4585.0,2.7,25.0,,,,
ABBOTINDIA.NS,Godrej BKC,"16th Floor, Plot C-68, “G” Block Bandra-Kurla Complex Near MCA Club, Bandra (East)",Mumbai,400051,India,91 22 5046 1000,,https://www.abbott.co.in,Drug Manufacturers - General,drug-manufacturers-general,Drug Manufacturers - General,Healthcare,healthcare,Healthcare,"Abbott India Limited operates as a pharmaceutical company in India. It offers pharmaceutical products for various therapeutic areas, such as women's health, gastroenterology, metabolic, central nervous system, and vaccines, as well as multispecialty products for insomnia, vitamin D, pre-term labor, and pain management; and anti-infectives, cardio-diabetic, hormones, respiratory, hepatic, consumer care, gastro. The company was founded in 1910 and is headquartered in Mumbai, India. Abbott India Limited is a subsidiary of Abbott Capital India Limited.",3700.0,"[{'maxAge': 1, 'name': 'Mr. Vivek V. Kamath', 'title': 'MD & Executive Director', 'fiscalYear': 2023, 'totalPay': 64300000, 'exercisedValue': 0, 'unexercisedValue': 0}, {'maxAge': 1, 'name': 'Mr. Sridhar  Kadangode', 'title': 'Chief Financial Officer', 'fiscalYear': 2023, 'exercisedValue': 0, 'unexercisedValue': 0}, {'maxAge': 1, 'name': 'Ms. Sangeeta Mukesh Shetty', 'title': 'Company Secretary & Compliance Officer', 'fiscalYear': 2023, 'exercisedValue': 0, 'unexercisedValue': 0}, {'maxAge': 1, 'name': 'Mr. Rajan  Kalantre', 'title': 'Director of Business Human Resources', 'fiscalYear': 2023, 'exercisedValue': 0, 'unexercisedValue': 0}]",1703980800.0,86400,2,25508.65,25544.85,25522.5,26249.95,25508.65,25544.85,25522.5,26249.95,180.0,0.0070999996,1689897600.0,0.35369998,0.62,0.097,50.78101,23752,23752,18464,22654,22654,550504562688,19900.0,26381.65,9.763472,23826.434,23051.438,INR,531907182592,0.1918,5210354,21249300,0.75482005,0.07436,21252500,1463.062,17.707348,1680220800,1711843200,1696032000,0.179,10814300160,510.17,,,9.434,41.295,0.23227513,0.19561028,145.0,1689897600.0,NSI,EQUITY,ABBOTINDIA.NS,ABBOTINDIA.NS,ABBOTT INDIA LTD,Abbott India Limited,1029123900,Asia/Kolkata,IST,fcc0ae23-ea96-3972-b294-97ea94bbc9ed,finmb_9608883,19800000,25906.95,none,19515500544,918.402,12880700416.0,915400000.0,1.868,2.367,56384098304,2.944,2653.473,0.18318,0.37140998,10574162944.0,12068100096.0,0.179,0.083,0.44065,0.22845,0.24298,INR,,,,,,,,,,,,,,,,,,,,
ACC.NS,Cement House,"121, Maharshi Karve Road",Mumbai,400020,India,91 22 4159 3321,91 22 6631 7458,https://www.acclimited.com,Building Materials,building-materials,Building Materials,Basic Materials,basic-materials,Basic Materials,"ACC Limited manufactures and sells cement and ready-mix concrete in India. It operates in Cement and Ready Mix Concrete segments. The company provides ordinary Portland cement; blended cement, including Portland Pozzolana cement, Portland slag cement, and composite cement; gold and silver range of cement; ready mixed concrete value-added products; and bulk cement. It also offers construction chemicals, such as ACC LeakBlock, a polymer-based integral waterproofing compound used in various types of cement mortar, plasters, and concrete; ACC LeakBlock WaterProof Plaster - LB 101, a ready-to-use cementitious waterproof mortar for internal and external plaster applications; and tile adhesives. In addition, the company provides EcoMaxx, a concrete with lower embodied carbon content for various structural components applications comprising foundations, columns, beams, external or internal walls, driveways, walkways, etc. The company distributes its products through a network of dealers, retailers, engineers, and architects. The company was formerly known as The Associated Cement Companies Limited and changed its name to ACC Limited in September 2006. ACC Limited was incorporated in 1936 and is headquartered in Mumbai, India. ACC Limited is a subsidiary of Ambuja Cements Limited.",5167.0,"[{'maxAge': 1, 'name': 'Mr. Ajay A. Kapur B.A., M.M.S.', 'age': 58, 'title': 'CEO & Whole-Time Director', 'yearBorn': 1965, 'exercisedValue': 0, 'unexercisedValue': 0}, {'maxAge': 1, 'name': 'Mr. Vinod Mohanlal Bahety', 'title': 'Chief Financial Officer', 'exercisedValue': 0, 'unexercisedValue': 0}, {'maxAge': 1, 'name': 'Mr. Sukuru  Ramarao', 'title': 'Chief Operating Officer', 'exercisedValue': 0, 'unexercisedValue': 0}, {'maxAge': 1, 'name': 'Mr. Vineet  Bose', 'age': 45, 'title': 'Chief Legal Officer', 'yearBorn': 1978, 'exercisedValue': 0, 'unexercisedValue': 0}, {'maxAge': 1, 'name': 'Mr. Hitesh L. Marthak', 'title': 'Company Secretary & Compliance Officer', 'exercisedValue': 0, 'unexercisedValue': 0}, {'maxAge': 1, 'name': 'Mr. Diwakar  Payal', 'age': 65, 'title': 'Chief Sales & Marketing Officer', 'yearBorn': 1958, 'exercisedValue': 0, 'unexercisedValue': 0}, {'maxAge': 1, 'name': 'Mr. Jayant  Kumar M.Tech.', 'age': 66, 'title': 'Chief Human Resources Officer', 'yearBorn': 1957, 'exercisedValue': 0, 'unexercisedValue': 0}, {'maxAge': 1, 'name': 'Mr. Sudipto  Bhattacharya', 'age': 62, 'title': 'Senior Vice President', 'yearBorn': 1961, 'exercisedValue': 0, 'unexercisedValue': 0}, {'maxAge': 1, 'name': 'Mr. C.  Kurian', 'age': 56, 'title': 'Chief Executive Officer of ACC Concrete & B2B Business', 'yearBorn': 1967, 'exercisedValue': 0, 'unexercisedValue': 0}, {'maxAge': 1, 'name': 'Mr. Suresh K. Rathi', 'age': 61, 'title': 'Chief Supply Chain Officer and Head of Fuel, Raw Materials & Inbound Logistics', 'yearBorn': 1962, 'exercisedValue': 0, 'unexercisedValue': 0}]",,86400,2,2513.15,2514.0,2469.2,2584.0,2513.15,2514.0,2469.2,2584.0,9.25,0.0037,1688688000.0,1.3367,1.3,0.348,58.51656,752839,752839,623421,786554,786554,477786505216,1592.35,2584.0,2.4703157,2169.278,1959.8103,INR,471826857984,0.084130004,71255223,187787008,0.64095,0.24297,187908000,789.38,3.2231624,1680220800,1711843200,1703980800,3.751,16272100352,43.48,,,2.44,19.102,0.36107123,0.19561028,9.25,1688688000.0,NSI,EQUITY,ACC.NS,ACC.NS,ACC LIMITED,ACC Limited,1025495100,Asia/Kolkata,IST,6d4ebf5e-ede8-36f1-b882-ab0f9673eaa6,finmb_873802,19800000,2544.3,buy,10059599872,53.57,24700059648.0,4068199936.0,,,193411104768,2.745,1029.935,,,,,3.75,0.083,0.49146998,0.12771,0.13623,INR,,10.0,5.0,2.0,9.0,7.0,1706400000.0,21.08303,120.68,5.06,3600.0,1800.0,2440.38,2430.0,2.0,37.0,,,,
ADANIENT.NS,Adani Corporate House,"Shantigram Near Vaishnodevi Circle S. G. Highway, Khodiyar",Ahmedabad,382421,India,91 79 2555 5286,91 79 2555 5500,https://www.adanienterprises.com,Thermal Coal,thermal-coal,Thermal Coal,Energy,energy,Energy,"Adani Enterprises Limited, together with its subsidiaries, engages in the coal trading, mining, logistics, power generation, edible oil and agro commodities, and other businesses in India and internationally. The company trades in coal; offers integrated coal management services; imports apples, pears, kiwis, oranges, grapes, and other fruits; markets fruits under the FARM-PIK brand; generates solar and wind energy; and manufactures solar panels. It is also involved in the mining of various coal and iron ore properties, as well as minerals, such as limestone, chromite, diamond, bauxite, and graphite. In addition, company offers edible oils, basmati rice, pulses, soya chunks, besan, and atta, as well as lauric and bakery fats, castor oil derivatives, oleo chemicals, and soya value added products under the Fortune, King's, Bullet, Raag, Avsar, Pilaf, Jubilee, Fryola, Alpha, and Aadhar brands. Further, it manufactures fighter aircraft, unmanned aerial systems, helicopters, submarines, air defence guns, and missiles and small arms; develops avionics and systems, opto-electronics, aero structures and components, aerospace composites, and radar and electronic warfare systems, as well as constructs national highways, motorways, tunnels, metro-rail, railways, etc. Additionally, it engages in the waste water treatment, recycle, and reuse business; and operates, manage, and develops airports; and builds data centers. The company was founded in 1988 and is headquartered in Ahmedabad, India. Adani Enterprises Limited operates as a subsidiary of S.B. Adani Family Trust.",6647.0,"[{'maxAge': 1, 'name': 'Mr. Gautambhai Shantilal Adani S.Y. B.Com', 'age': 61, 'title': 'Executive Chairman', 'yearBorn': 1962, 'fiscalYear': 2023, 'totalPay': 23900000, 'exercisedValue': 0, 'unexercisedValue': 0}, {'maxAge': 1, 'name': 'Mr. Rajeshbhai Shantilal Adani B.Com.', 'age': 59, 'title': 'MD & Director', 'yearBorn': 1964, 'fiscalYear': 2023, 'totalPay': 56000000, 'exercisedValue': 0, 'unexercisedValue': 0}, {'maxAge': 1, 'name': 'Mr. Jugeshinder  Singh', 'title': 'Group Chief Financial Officer', 'fiscalYear': 2023, 'totalPay': 772100000, 'exercisedValue': 0, 'unexercisedValue': 0}, {'maxAge': 1, 'name': 'Mr. Jatinkumar  Jalundhwala', 'age': 63, 'title': 'Joint President of Legal, Compliance Officer & Company Secretary', 'yearBorn': 1960, 'fiscalYear': 2023, 'totalPay': 30500000, 'exercisedValue': 0, 'unexercisedValue': 0}, {'maxAge': 1, 'name': 'Mr. Vinay Prakash Goel', 'age': 50, 'title': 'CEO of Natural Resources & Executive Director', 'yearBorn': 1973, 'fiscalYear': 2023, 'totalPay': 522500000, 'exercisedValue': 0, 'unexercisedValue': 0}, {'maxAge': 1, 'name': 'Mr. Pranav Vinodbhai Adani', 'age': 45, 'title': 'MD of Agro, Oil & Gas and Executive Director', 'yearBorn': 1978, 'fiscalYear': 2023, 'totalPay': 45000000, 'exercisedValue': 0, 'unexercisedValue': 0}, {'maxAge': 1, 'name': 'Mr. Sudipta  Bhattacharya', 'age': 56, 'title': 'Group CTO & CEO of Adani Group North America', 'yearBorn': 1967, 'fiscalYear': 2023, 'exercisedValue': 0, 'unexercisedValue': 0}, {'maxAge': 1, 'name': 'Ms. Varsha  Chainani', 'title': 'Head of Corporate Communications', 'fiscalYear': 2023, 'exercisedValue': 0, 'unexercisedValue': 0}, {'maxAge': 1, 'name': 'Mr. Vikram  Tandon', 'title': 'Group Chief Human Resources Officer', 'fiscalYear': 2023, 'exercisedValue': 0, 'unexercisedValue': 0}, {'maxAge': 1, 'name': 'Mr. Pradeep K. Bhargava', 'age': 64, 'title': 'Head of Management Assurance & Audit Services', 'yearBorn': 1959, 'fiscalYear': 2023, 'exercisedValue': 0, 'unexercisedValue': 0}]",1703980800.0,86400,2,3091.1,3092.75,3072.4,3151.7,3091.1,3092.75,3072.4,3151.7,1.2,0.0004,1688688000.0,0.0559,0.65,0.74,147.30426,2670144,2670144,3603802,3152381,3152381,3582414028800,1017.45,3199.0,3.382378,2822.342,2476.2043,INR,4117057503232,0.02308,257151825,1140000000,0.77309,0.12513,1140169984,298.9,10.511877,1680220800,1711843200,1696032000,-0.506,24442900480,21.33,2:1,1260403200.0,3.887,43.103,0.44758475,0.19561028,1.2,1688688000.0,NSI,EQUITY,ADANIENT.NS,ADANIENT.NS,ADANI ENTERPRISES,Adani Enterprises Limited,1025495100,Asia/Kolkata,IST,89927796-44d5-31a1-abc2-b83ed0472098,finmb_883013,19800000,3142.0,none,84126498816,73.853,95516901376.0,571446394880.0,0.355,0.799,1059140599808,136.906,928.872,0.03216,0.064959995,-20896774144.0,201008594944.0,-0.506,-0.41,0.35821998,0.090179995,0.0789,INR,,9.0,8.0,2.0,5.0,7.0,1706400000.0,,,,,,,,,,,,,
ADANIPORTS.NS,Adani Corporate House,Shantigram Near Vaishnodevi Circle S G Highway,Ahmedabad,382421,India,91 79 2656 5555,91 79 2555 6490,https://www.adaniports.com,Marine Shipping,marine-shipping,Marine Shipping,Industrials,industrials,Industrials,"Adani Ports and Special Economic Zone Limited, together with its subsidiaries, operates and maintains port infrastructure facilities in India. The company operates 13 ports and terminals, including bulk and break bulk, container, liquid, LPG, LNG, and crude cargos. It also engages in the ports related infrastructure development activities; and development of infrastructure at contiguous Special Economic Zone at Mundra. In addition, it offers logistic services, which includes first mile and last mile solutions through logistic parks, container rail and bulk cargo logistic solutions, and warehousing, as well as auto, road, and agriculture logistic services. Further, the company operates a fleet of dredging and reclamation service equipment comprising cutter suction, trailing suction hopper, grab, inland cutter suction, water injection, and specialized dredgers, as well as split hopper and jack up barges, and floating cranes. Additionally, it offers non-scheduled passenger airline; hospital and related services; and marine services, such as pilotage, laying, and maintenance of buoys. The company also engages in development, construction, operation, and maintenance of railway corridors; and land development activities. The company as incorporated in 1998 and is headquartered in Ahmedabad, India.",2959.0,"[{'maxAge': 1, 'name': 'Mr. Gautambhai Shantilal Adani S.Y. B.Com', 'age': 61, 'title': 'Executive Chairman', 'yearBorn': 1962, 'fiscalYear': 2023, 'totalPay': 18000000, 'exercisedValue': 0, 'unexercisedValue': 0}, {'maxAge': 1, 'name': 'Mr. Karan Gautam Adani', 'age': 36, 'title': 'Managing Director & Director', 'yearBorn': 1987, 'fiscalYear': 2023, 'totalPay': 53900000, 'exercisedValue': 0, 'unexercisedValue': 0}, {'maxAge': 1, 'name': 'Mr. D.  Muthukumaran', 'age': 50, 'title': 'Chief Financial Officer', 'yearBorn': 1973, 'fiscalYear': 2023, 'exercisedValue': 0, 'unexercisedValue': 0}, {'maxAge': 1, 'name': 'Mr. Charanjit  Singh', 'title': 'Head - ESG & IR', 'fiscalYear': 2023, 'exercisedValue': 0, 'unexercisedValue': 0}, {'maxAge': 1, 'name': 'Mr. Kamlesh  Bhagia', 'title': 'Company Secretary & Compliance Officer', 'fiscalYear': 2023, 'exercisedValue': 0, 'unexercisedValue': 0}, {'maxAge': 1, 'name': 'Captain Umesh  Shedde', 'age': 63, 'title': 'General Manager of Marketing & Business Development', 'yearBorn': 1960, 'fiscalYear': 2023, 'exercisedValue': 0, 'unexercisedValue': 0}, {'maxAge': 1, 'name': 'Dr. Jayant  Kumar', 'age': 52, 'title': 'Head of Human Resources', 'yearBorn': 1971, 'fiscalYear': 2023, 'exercisedValue': 0, 'unexercisedValue': 0}, {'maxAge': 1, 'name': 'Captain Sandeep M. Mehta', 'age': 62, 'title': 'President of Business Development', 'yearBorn': 1961, 'fiscalYear': 2023, 'exercisedValue': 0, 'unexercisedValue': 0}, {'maxAge': 1, 'name': 'Mr. Ennarasu  Karunesan', 'age': 56, 'title': 'Chief Executive Officer of Southern Region', 'yearBorn': 1967, 'fiscalYear': 2023, 'exercisedValue': 0, 'unexercisedValue': 0}, {'maxAge': 1, 'name': 'Mr. Jai  Khurana', 'age': 51, 'title': 'Head of Business Development', 'yearBorn': 1972, 'fiscalYear': 2023, 'exercisedValue': 0, 'unexercisedValue': 0}]",1703980800.0,86400,2,1187.35,1195.8,1191.65,1214.25,1187.35,1195.8,1191.65,1214.25,5.0,0.0042,1690502400.0,0.1705,0.5,0.51,41.174564,5508216,5508216,7642283,6906434,6906434,2608693248000,395.1,1229.9,11.111708,1051.185,839.2545,INR,3054984232960,0.26992,708819070,2160140032,0.60828996,0.20527,2160800000,225.38,5.358284,1680220800,1711843200,1696032000,0.042,63369900032,29.33,5:1,1285200000.0,13.013,22.234,1.3979602,0.19561028,5.0,1690502400.0,NSI,EQUITY,ADANIPORTS.NS,ADANIPORTS.NS,ADANI PORT SPECIAL,Adani Ports and Special Economic Zone Limited,1196135100,Asia/Kolkata,IST,0e508bdb-0c93-3b9f-9c93-5d18b89cbef0,finmb_27674009,19800000,1207.65,buy,70454099968,32.61,137400098816.0,500603387904.0,0.825,1.24,234769793024,99.596,108.67,0.060289998,0.13502,6398962688.0,131291799552.0,0.041,0.276,0.64822,0.58525,0.43723,INR,,1.0,10.0,1.0,1.0,6.0,1706400000.0,36.13555,33.42,1.03,1001.0,735.0,863.46,871.0,1.8,24.0,,,,
